title,date,question,doctor,answer,url
"알레르기 체질, 코로나 백신접종 관련 문의입니다.",2021.07.15,"안녕하세요!
알레르기가 조금 심한 체질입니다.
알레르기가 심한 사람이면 코로나 백신이 부작용이 이는 경우가 많다고 해서,
제 체질도 백신접종이 가능할지 궁금해서 여쭤보고 싶어요.

제 알레르기 증상을 말씀드리자면 다음과 같습니다.

1. 비염환자이고, 방치해둬서 먼지가 조금 앉은 옷만 입어도 하루종일 온몸이 알레르기반응이 와요.
감기와 비슷하게 온몸에 열이 오르고 맑은 콧물이 멈추지 않습니다. (이게 알레르기성 비염이라고 하더라고요..)

2. 음식을 조금 잘못 먹으면 피부에 딱지가 앉으며 터집니다...일단 커피랑 술은 안 맞는 게 확실한 것 같네요.
마시면 반응이 거의 즉각.. 피부에 발진이 일기 시작합니다.
다행히 아직은 쇼크가 온다거나 쓰러지는 것까진 경험하지 못했는데...
그래도 염증반응은 즉각적이고, 나이가 먹을수록 알레르기 증상이 심해지는 것 같네요.

3. 거의 모든 종류의 진통제를 먹지 못합니다. 역시 알레르기반응을 수반한 부작용 때문입니다.
일단 아세트아미노펜, 덱시부프로펜 대중적인 성분들은 물론 불가능하고요.
제가 그런 체질이라니 의사선생님 몇분께서 성분을 우회해서 처방해주셔봤는데 역시나 부작용이 똑같이 났습니다.
어떤 종류의 부작용이냐면... 얼굴이 찐빵처럼 두배는 부어올라서 이목구비가 묻혀버려요. 눈을 못뜨고 괴롭습니다.
알레르기에 수반되는 콧물 재채기 등 여러 고통도 당연히 수반됩니다.
가라앉히기 위해선 물을 계속 들이켜서 수분을 배출시키면서 시간을 경과시키는 것 외엔 방법이 없었습니다.

제가 백신을 맞아도 괜찮은 사람인지 답변 부탁드립니다.ㅠ",김민한 [약사],"안녕하세요. 하이닥 상담약사 김민한입니다.
아래는 저의 의견입니다.
선생님은 안맞으셔도 됩니다.
동시에 사회의 평균 접종률이 6~70%가 넘어가야 합니다.

어린아이나 임산부들이 안맞는 것처럼
건강한사람들이 많이 면역을 갖춰
취약한 분들을 전파를 막아야 한다고 생각합니다.",https://www.hidoc.co.kr/healthqna/part/view/C0000618619
코로나 백신 항생제 알레르기,2021.07.14,"나이는 56세라 모더나 접종대상자입니다..

제가 항생제 알레르기가 있는데 한번은 옛날에 쇼크도 온적이 있습니다.

파지돈, 시프록사신, 레보플록사신, 세파클러 항생제에 알레르기 반응이 있습니다.

저 같은경우에는 모더나 또는 화이자 백신을 맞으면 안되나요?",송슬기 [전문의],"안녕하세요. 하이닥 외과 상담의 송슬기입니다.
위의 4가지 항생제 알러지 반응이 있으시다고 하더라도 모*나 혹은 코로나 백신 의 접종 절대적인 금기증은 아닌 듯 합니다. 의사선생님 진찰 및 문진표에는 작성을 해주셔야 합니다.",https://www.hidoc.co.kr/healthqna/part/view/C0000618128
포카리스웨트 매일 400ml 섭취 하는데 건강에 지장 있습니까?,2021.07.11,"포카리스웨트 매일 400ml 섭취 하는데 건강에 지장 있습니까?

저녁 먹기 전 200ml

밤 10시경 200ml 먹고 2~3시간 뒤 취침 합니다.

이렇게 매일 400ml 섭취 합니다.

나트륨 200mg 당 24g 입니다.

건강에 지장 있나요?",홍인표 [전문의],"안녕하세요. 하이닥 가정의학과 상담의 홍인표입니다.
개인마다 차이가 있을 것으로 생각합니다만 지금 키에 비하여 체중이 많이 나가니 당분 섭취를 줄여햐 하는데 포카리스*트는 드시지 않는 편이 좋겠습니다.",https://www.hidoc.co.kr/healthqna/part/view/C0000617175
치아교정 본뜬 후 입술 붓기,2021.07.10,"안녕하세요. 교정을 계획하고 잇는 20대 중반 남성입니다.

교정을 하기로 마음을 먹고 치과에서 치아 모형을 본 떴습니다.

그런데 본을 뜬 바로 다음날 저녁 부터 입술이 붓기 시작했습니다.

일단 아랫 입술만 붓게 됬는데, 본뜰때 쓰는 재료가 알러지를 유발하는 성분이 들어있나요?

(답변에 대해 미리 감사의 말씀 드립니다.)",홍인표 [전문의],"안녕하세요. 하이닥 가정의학과 상담의 홍인표입니다.
사진이라도 한 장 올려주셨으면 좋았을것욜요. 본뜰 때 사용하는 재료에 대한 알러지일 가능성도 있구요.
혈관부종이라는 증상이 나타났을 수도 있습니다. 점점 심해지면 진료를 받아보시는 것이 좋겠습니다.",https://www.hidoc.co.kr/healthqna/part/view/C0000617008
알레르기약 복용 식전 혈당상승,2021.06.24,"안녕하세요 알레르기 때문에

메치론 정, 씨잘정, 프리마란정 이라는 약을 먹고있는데요

이 약중에 혈당을 올리는게 있나요..?

저가 공복혈당장애를 판정받았습니다 (100으로)

그런데 식전 혈당이 115가 나오더라구요.(오늘 공복은 93 나왔습니다)

이 약중에 혈당을 상승시키는 약이 있나요?
그리고 이 약을 끊으면 혈당이 정상으로 돌아올까요..?",김정호 [약사],"안녕하세요. 하이닥 상담약사 김정호입니다.

메*론정과 같은 스테로이드는 복용시 일시적으로 혈당을 올릴 수 있습니다.
만성적인 염증으로 인해 고용량을 장기간 복용하는것이 아니라 알러지 처럼 저용량으로 단기 복용 하시는 경우에는
복용을 중단하게 되면 다시 돌아오는 경우가 많습니다.
다만 공복혈당장애를 진단 받으셨다면, 그 부분에 대한 근본적인 치료 및 생활습관 교정이 필요할 것으로 보입니다.",https://www.hidoc.co.kr/healthqna/part/view/C0000612852
알레르기 증상인가요?,2021.06.19,"제가 다니는 독서실에 들어가면 뭔가 공기가 탁하다는 느낌이 나고 목 간지러움과 기침이 자주 나요. 제가 알레르기 비염과 알레르기로 인한 눈 염증, 집먼지에 대안 알레르기를 좀 가지고 있긴 합니다만, 독서실에서 코가 막히는 등 비염의 증상은 없고 위에서 말한 목 간지러움, 기침만 나타나요. 그런데도 먼지 알레르기라고 하기도 좀 애매한게 독서실에서 KF94 마스크를 계속 쓰고 있는데도 기침이 자꾸 납니다. 독서실 관계자 말로는 독서실 학습 공간에서 환기도 자주 한다고 하고요.

그래서 이 증상이 독서실 환경에서 먼지나 다른 요인에 인한 알레르기 증상일까요 아니면 그냥 기분탓인가요? 정확한 건 검사를 받아봐야 알 수 있겠지만 대략 무슨 이유로 그런지 알고싶어요.",송슬기 [전문의],"안녕하세요. 하이닥 외과 상담의 송슬기입니다.
알러지에 의한 원인은 크게 세가지로 나눕니다. MAST 알러지 테스트 종합 검사를 받으시면 알러겐 원인 물질을 쉽게 찾으실 수 있습니다.",https://www.hidoc.co.kr/healthqna/part/view/C0000611315
페니라민정과 부광아젭틴정을 처방 받았는데요,2021.06.27,"페니라민은 매 식후 1알
부광아젭틴은 아침저녁 식후 1알
복용 안내 받았는데요
아침저녁에 페니라민이랑 부광아젭틴 함께 먹어도 되는 건가요?",김민한 [약사],"안녕하세요. 하이닥 상담약사 김민한입니다.
넵 같이 드셔도 됩니다^^
둘 다 알러지약의 일종인 항히스타민제라
중복되는게 아닌가 우려되실건데요.
항히스타민제는 하나를 고용량으로 쓰는거보다 저용량 2~3가지를 복합으로 더 많이씁니다.
부작용을 줄이고 효과는 증가하는 효과가 있습니다.",https://www.hidoc.co.kr/healthqna/part/view/C0000613322
알레르기약 복용 식전 혈당상승,2021.06.24,"안녕하세요 알레르기 때문에

메치론 정, 씨잘정, 프리마란정 이라는 약을 먹고있는데요

이 약중에 혈당을 올리는게 있나요..?

저가 공복혈당장애를 판정받았습니다 (100으로)

그런데 식전 혈당이 115가 나오더라구요.(오늘 공복은 93 나왔습니다)

이 약중에 혈당을 상승시키는 약이 있나요?
그리고 이 약을 끊으면 혈당이 정상으로 돌아올까요..?",김정호 [약사],"안녕하세요. 하이닥 상담약사 김정호입니다.

메*론정과 같은 스테로이드는 복용시 일시적으로 혈당을 올릴 수 있습니다.
만성적인 염증으로 인해 고용량을 장기간 복용하는것이 아니라 알러지 처럼 저용량으로 단기 복용 하시는 경우에는
복용을 중단하게 되면 다시 돌아오는 경우가 많습니다.
다만 공복혈당장애를 진단 받으셨다면, 그 부분에 대한 근본적인 치료 및 생활습관 교정이 필요할 것으로 보입니다.",https://www.hidoc.co.kr/healthqna/part/view/C0000612852
피부 가렵고 붓는 원인이 궁금합니다,2021.06.20,"오늘 내 괜찮다가 갑자기 얼굴 피부가 가려워서 이마와 인중, 귀 옆쪽 턱을 긁었더니 순식간에 붉고 딴딴하게 부어 오르더라고요 특별히 알레르기가 날 만한 일이 없었는데 이유 없이도 이럴 수 있나요?

낮에 햇볕이 뜨거울 때 나가서 산책을 하고 왔는데 뒤늦게 햇볕 알레르기처럼 이럴 수도 있나요?",김지우 [의사],"안녕하세요. 하이닥 상담의 김지우입니다.

혈액 상태나 혈액 세포에 이상이 있거나
신장 기능이 떨어지면 그런 증상이 생길 수 있습니다.
가까운 의원이나 병원에가셔서 피검사,소변검사 하시기바랍니다.",https://www.hidoc.co.kr/healthqna/part/view/C0000611524
