title,date,question,doctor,answer,url
(★)이비인후과 목에 관련하여 질문드립니다! 꼼꼼한질문! 답변! 부탁드려요! ㅠㅠ,2019.07.04,"목 상태가 계속 안 좋아서 상담 문의드립니다.

저의 증상은 : 계속 목이 건조하고 목이 건조해서 말을 오래 하지 못합니다.
조금만 말해도 목이 건조하고 이물감 지속적으로 느껴집니다. ㅠㅠ
*(아침부터 시작-늦은 저녁에는 조금 낳아지지만 킁킁은 여전)

조금만 말해도 목소리가 잠기고 말하다가도 킁킁대고(목 이물감) 목소리가 안 나구요. ㅜㅜ
계속 가래를 빼내려는 행동으로 킁킁거리는 게 가장 심하고, 그러다 보니(?) 목소리도 잘 안 나오네요.
코가 한상 한쪽이 막혀 잇고(비염 증상 있음) 갑갑한 느낌 쉰 목소리가 납니다. ㅠㅠ

역류성 식도염일 수 있다고 뜨거운 기운이 올라와서 목을 건드릴 수 있다고 하여,
위산 약도 먹어보고, 코에 뭐 뿌려보는것도 해보고!
물도 많이 먹어보고 휴식도 많이 취해봤지만 계속 목 상태가 안 좋네요 .. (효과 없음)
저녁에 먹고 바로 눕는 행동 그런 것도 다 안 해봤고요! ㅠㅠ

제가 하는 업무가 고객들과 소통하며 말을 해야 하는 직업인데 ㅠㅠ
통화를 하면서 계속 킁킁거리는 현상에 목도 불편하고 주변 사람들도 불편하고,
업무도 힘들어(계속 병가 쓰거나, 진료를 보는 행동) 등으로 퇴사한 상태입니다. ㅠㅠ

작년(가을겨울쯤)에는 헛기침을 심하게 하면서부터 목소리도 잘 안 나오기도 하고 잠기기도 했던 적도 있습니다.
이비인후과 갈 때마다 감기다/역류성 식도염이다 등등 대충 상담으로 약도 많이 복용해봐도 낳지 않아서 대학병원 호흡기 내과까지 가서 검사를 받아보니,
천식이나 다른 이상 증상은 없다고 하여 이비인후과로 가보라고 하셨습니다.
한의원도 가보고 한약도 먹어봤지만 ㅠㅠ 이제 병원 가서 큰 금액을 더 이상 쓰고 싶지 않아서 이렇게 간절한 마음으로 올려봅니다.

*추가로 : 잘 때 코를 너무 골아 수면 무호흡 증상으로 눈뜨면 앉아서 자고 있거나 새벽 내내 너무 잠을 깨고 일어나면 혀에 항상 침이 말라있었습니다.
현재는 수면 무호흡 검사 등을 하여 양압기 7개월째 사용하고 있습니다.
(한 번도 안 깨고 잘 잠, 피곤하지 않음, 혀 말라 있지 않음, 양압기 사용은 만족 중입니다.)

병원 홍보나, 병원에 가보라거나 이제 그런 거 말고 ㅜㅜ 한 번만 살려주시는 바람으로 어떤 증상인지, 어떤 약을 먹어보라거나,
어떤 음식이 좋다거나 효과가 있는 방향에 대해서 설명해주시면 좋을 것 같습니다.
(이제는 또 취직을 해야 하는데 면접 때도 킁킁 그려서 자신감도 많이 떨어지네요..)",한재병 [전문의],안녕하세요. 하이닥 응급의학과 상담의 한재병입니다.,https://www.hidoc.co.kr/healthqna/part/view/C0000469605
폐 석회화가 섬유화증인가요??,2019.07.03,비활동성 폐결핵 (석회화) 됬다는게 섬유화증(간질성폐질환)과 똑같은 건가요?,한재병 [전문의],안녕하세요. 하이닥 응급의학과 상담의 한재병입니다.,https://www.hidoc.co.kr/healthqna/part/view/C0000469527
폐결절 관련,2019.07.03,"안녕하세요. 선생님.

며칠 전 폐결절 관련해서 CT 사진 올린 사람입니다.
동영상으로 친절히 답변해 주셔서 진심으로 감사 드립니다.

추가 질문이 있어서요.
(사진은 추가하였습니다.)

1. 두 사진의 크기 변화가 의미있는 변화로 보기 힘들다고 하셨는데요.
혹시 두 사진의 크기 차이가 CT 기계 및 CT 조건(슬라이스)에서
생길 수 있는 차이인지요?

2. 제가 진료를 본 두곳의 병원에서는 자국이 혈관이라고 했는데요.
선생님께서 보시기에도 혈관일 수 있는지요?
(혈관과 결절이 구분이 되는지 안되는지 모르겠지만, 한곳은 결절
두곳은 혈관일 수 있다하니 혼란 스럽습니다.)

귀찮게 해 드려 죄송합니다. 답변 부탁 드립니다.
(종합병원은 24일 방문 예정입니다. 대기 기간이 너무 길어서 문의
드리니 이해 부탁 드립니다.)",한재병 [전문의],안녕하세요. 하이닥 응급의학과 상담의 한재병입니다.,https://www.hidoc.co.kr/healthqna/part/view/C0000469490
폐결절 관련,2019.07.03,"안녕하세요. 선생님.

며칠 전 폐결절 관련해서 CT 사진 올린 사람입니다.
동영상으로 친절히 답변해 주셔서 진심으로 감사 드립니다.

추가 질문이 있어서요.
(사진은 추가하였습니다.)

1. 두 사진의 크기 변화가 의미있는 변화로 보기 힘들다고 하셨는데요.
혹시 두 사진의 크기 차이가 CT 기계 및 CT 조건(슬라이스)에서
생길 수 있는 차이인지요?

2. 제가 진료를 본 두곳의 병원에서는 자국이 혈관이라고 했는데요.
선생님께서 보시기에도 혈관일 수 있는지요?
(혈관과 결절이 구분이 되는지 안되는지 모르겠지만, 한곳은 결절
두곳은 혈관일 수 있다하니 혼란 스럽습니다.)

귀찮게 해 드려 죄송합니다. 답변 부탁 드립니다.
(종합병원은 24일 방문 예정입니다. 대기 기간이 너무 길어서 문의
드리니 이해 부탁 드립니다.)",한재병 [전문의],안녕하세요. 하이닥 응급의학과 상담의 한재병입니다.,https://www.hidoc.co.kr/healthqna/part/view/C0000469490
폐결핵 흉터,2019.06.30,"건강검진 흉부엑스레이 결과 비활동성 폐결핵 이라는데
추적관찰이 필요하지 않다고 써있습니다.
그럼 따로 검사를 안받아도 되나요??? 어디선 엑스레이는 비정확하다고 하는데 써있는대로 추적관찰을 받지 말아야할지 궁금합니다",장원 [전문의],"안녕하세요. 하이닥 내과 상담의 장원입니다.

혹시 결핵을 앓았던 적이 있었나요?
비활동성 폐결핵으로 의심되는 병소만 흉부 방사선 촬영에서 있었다면 결핵 관련 증상이 없는 한 따로 검사를 받을 필요 없습니다. 그러나 잠복결핵에 대해 치료가 필요할 수는 있겠습니다. 자세한 병력 청취와 신체 검진을 위해 내과 전문의에게 상담 받아보기를 권유 드립니다.

감사합니다",https://www.hidoc.co.kr/healthqna/part/view/C0000469097
흉부엑스레이 비 활동성 결핵 이라는데,2019.06.30,"흉부엑스레이 결과가 비활동성 결핵흔적이라고 나오는건
폐에 무언가 있는데 그게 뭔지 잘 모를때 쓰는 표현인가요?
아니면 진짜 결핵의 흔적인가요??",김대연 [전문의],"안녕하세요. 하이닥 흉부외과 상담의 김대연입니다.

영상 판독으로 비활동성으로 나오는 것은 석회화 병소가 있는 것으로 활동성이 없다는 것입니다.
확실한 진단을 위해서는 객담 검사가 필요 할 수도 있습니다.

감사합니다. ",https://www.hidoc.co.kr/healthqna/part/view/C0000469098
목 이물감..불편함?,2019.06.30,"보름전? 아니 그전부터 인지는 모르겠으나 ?
목에 뭔가 걸려 있는것 같은 느낌이 있습니다.
꼭 가래 낀것 같기도 하구요..
특히 물 같은 액체를 마실때 ..
시원하게 내려 가는게 아니라 이물감 있게 내려 가는것 같기도 하고..
다른 음식물 섭취시엔 별 느낌이 없습니다.
그리고
흰 가래가 좀 나옵니다.
많이 나오진 않지만. .흰가래가 좀 나오네요..
한달전 위 내시경 검사를 받았을때..
비 수면 내시경으로 받았는데 ..
내시경 시술시 좀 상처가 났는지 당일날 좀 피가 섞인 가래가 나왔습니다.
목에 통증도 있었구요.
한달전 일이라 괜찮을줄 알았는데..
또.
내시경 소견은 역류성 식도염이 있다고 하는데..
상기 증상과 관련이 있는지요?",장형준 [전문의],"안녕하세요. 하이닥 이비인후과 상담의 잇츠비의원 장형준입니다.

목에 이물감이 있으셔서 질문을 주셨군요
목에 걸린느낌이 드는 이유는 목에 자극이 되는 원인이 있어서 그런 증상이 나타납니다.

첫째, 목자체의 문제일 수 있습니다.
특히 한달전 내시경 검사를 한뒤 상처도 났다고 하셨는데요. 그 후유증때문에 현재 목에 불편함이 남아 있을 수 있습니다.
이것은 점막이 회복되면서 점차 좋아지게 됩니다.

사실 위의 원인보다는 위쪽에서 무엇인가 넘어와 자극되거나, 아래에서 올라와 자극되어 목에 이물감이 생기는 경우가 더 많습니다.

위쪽에서 넘어오는 경우는 후비루 증상때문에 그럴 수 있습니다.
원래 콧물은 정상적으로 하루에 700cc 정도 목으로 넘어갑니다.
하지만 정상 농도일때는 이것을 느끼지 못하다가, 점도가 진해지는 경우 이런 후비루 증상이 나타날 수 있고 그로 인해 뭔가 가래가 낀듯한 느낌이 계속 생깁니다.
후비루증상이나 나타나는 가장 흔한 원인은 비염이나 축농증 같은 염증반응입니다.
이로 인해 점도가 높아지면 후비루를 느끼거나 목에 가래가 자꾸 생기는 느낌이 들 수 있습니다.

마지막으로는 아래에서 소위 신물이 올라롸 그럴 수 있습니다.
특히 질문자분의 경우 위식도역류-인후두역류증을 진단받았는데, 위산이 본인도 모르는 사이에 올라와 후두와 식도입구부위를 자꾸 자극하면 목에 이물감이 발생할 수 있습니다.
이는 약물치료와 함께 생활습관의 조절을 하셔야 합니다.
자기전 2시간전부터 먹지말기, 과식, 음주 흡연, 카페인 금지, 복압증가하는 경우 금지 등..
또한 과체중으로 보이시는데 이에 대한 조절도 필요하겠습니다.

일단 이비인후과에 방문하셔서 정확한 진단을 받고 그에 따라 치료하시기 바랍니다.",https://www.hidoc.co.kr/healthqna/part/view/C0000469165
목 이물감..불편함?,2019.06.30,"보름전? 아니 그전부터 인지는 모르겠으나 ?
목에 뭔가 걸려 있는것 같은 느낌이 있습니다.
꼭 가래 낀것 같기도 하구요..
특히 물 같은 액체를 마실때 ..
시원하게 내려 가는게 아니라 이물감 있게 내려 가는것 같기도 하고..
다른 음식물 섭취시엔 별 느낌이 없습니다.
그리고
흰 가래가 좀 나옵니다.
많이 나오진 않지만. .흰가래가 좀 나오네요..
한달전 위 내시경 검사를 받았을때..
비 수면 내시경으로 받았는데 ..
내시경 시술시 좀 상처가 났는지 당일날 좀 피가 섞인 가래가 나왔습니다.
목에 통증도 있었구요.
한달전 일이라 괜찮을줄 알았는데..
또.
내시경 소견은 역류성 식도염이 있다고 하는데..
상기 증상과 관련이 있는지요?",장형준 [전문의],"안녕하세요. 하이닥 이비인후과 상담의 잇츠비의원 장형준입니다.

목에 이물감이 있으셔서 질문을 주셨군요
목에 걸린느낌이 드는 이유는 목에 자극이 되는 원인이 있어서 그런 증상이 나타납니다.

첫째, 목자체의 문제일 수 있습니다.
특히 한달전 내시경 검사를 한뒤 상처도 났다고 하셨는데요. 그 후유증때문에 현재 목에 불편함이 남아 있을 수 있습니다.
이것은 점막이 회복되면서 점차 좋아지게 됩니다.

사실 위의 원인보다는 위쪽에서 무엇인가 넘어와 자극되거나, 아래에서 올라와 자극되어 목에 이물감이 생기는 경우가 더 많습니다.

위쪽에서 넘어오는 경우는 후비루 증상때문에 그럴 수 있습니다.
원래 콧물은 정상적으로 하루에 700cc 정도 목으로 넘어갑니다.
하지만 정상 농도일때는 이것을 느끼지 못하다가, 점도가 진해지는 경우 이런 후비루 증상이 나타날 수 있고 그로 인해 뭔가 가래가 낀듯한 느낌이 계속 생깁니다.
후비루증상이나 나타나는 가장 흔한 원인은 비염이나 축농증 같은 염증반응입니다.
이로 인해 점도가 높아지면 후비루를 느끼거나 목에 가래가 자꾸 생기는 느낌이 들 수 있습니다.

마지막으로는 아래에서 소위 신물이 올라롸 그럴 수 있습니다.
특히 질문자분의 경우 위식도역류-인후두역류증을 진단받았는데, 위산이 본인도 모르는 사이에 올라와 후두와 식도입구부위를 자꾸 자극하면 목에 이물감이 발생할 수 있습니다.
이는 약물치료와 함께 생활습관의 조절을 하셔야 합니다.
자기전 2시간전부터 먹지말기, 과식, 음주 흡연, 카페인 금지, 복압증가하는 경우 금지 등..
또한 과체중으로 보이시는데 이에 대한 조절도 필요하겠습니다.

일단 이비인후과에 방문하셔서 정확한 진단을 받고 그에 따라 치료하시기 바랍니다.",https://www.hidoc.co.kr/healthqna/part/view/C0000469165
폐결핵 흉터,2019.06.29,"폐결핵흉터와 간질성폐질환이 엑스레이상 비슷하게
보일수도 있나요?
아님 완전히 구별이 될정도로 다른 영상인가요?",김지우 [의사],"안녕하세요. 하이닥 상담의 김지우입니다.
폐결핵 흉터와 간질성 폐질환이 엑스레이상 비슷하게 보일 수 있습니다.
그래서 피 검사,가래 검사 폐 ct 검사가 필요합니다.

다른 검사나 증상을 확인 안하면 구분이 안 될 정도로 엑스레이 사진이 비슷한 경우가 많아요.",https://www.hidoc.co.kr/healthqna/part/view/C0000469042
16세 남자 학생 코피 자주 나서,2019.06.23,"안녕 하세요
중2 년 남자 아이 할아버지와 둘이 오손 도곤 잘 살아가는데 자주 코피가 나서 병원에 서 피 검사를 했드니
진드기 df 수치 100 으로 나타 나서
독일제 면역 결핍 치료제를 3년 먹어야 한다고 하고 이약은 건보에 해당 하지 않아 1개월에 16만원이나
약값이 드니 코피 날때마다 그냥 약을 처방하여 줄테니 임시 조치로 치료 하라고 하하더군요 . 이불등 침구도 바꿔 주었는데
또 코피가나서 안타깝군요
국내 개발돈 약 또는 저렴 하게 치료 하는 방법이 있을 까 하고 조언을 부탁 드림니다",이성호 [전문의],"안녕하세요. 하이닥 이비인후과 상담의 이성호입니다.

진드기 수치(Df)가 높은 알레르기 비염이신거 같네요. 알레르기 비염이 있는 분들은 상대적으로 콧물이 많이 생기게 되고 코딱지도 많이 생겨 코를 자주 건드리게 되고, 게다가 코가 간지러우니까 코를 비비다보면 약해진 혈관이 터져 코피가 자주 납니다.

면역치료를 하는게 근본적인 치료 법이 되지만 비용이 상당하므로 현실적으로 쉽지는 않습니다..
알레르기 비염을 완화하는 쪽으로 치료를 해야할 것 같고 항히스타민제를 처방해주셨을것 같은데 약을 복용하면서 주기적으로 코세척을 해줘서 코 안에 생기는 딱지와 콧물을 제거하시는 것이 좋을 것 같습니다.

국내 개발된 약은 아직 없는것으로 알고 있고 항히스타민제와 코세척을 병행하여 알레르기를 억제하면 코피도 덜 날 것으로 생각됩니다.

감사합니다
또 문의사항 있으면 글을 남겨주세요",https://www.hidoc.co.kr/healthqna/part/view/C0000468131
7세아이 수족구.기존 가래많은상태.집에서 호흡기치료 풀라톤 가능 유무 ?,2019.06.29,"집에서 네블라이저로 호흡기치료 풀미칸 해줘도 되는지 궁금해요.
가래가 평소에도 있어서 기침해서 뱉는게 일상이 될 정도예요.",한재병 [전문의],안녕하세요. 하이닥 응급의학과 상담의 한재병입니다.,https://www.hidoc.co.kr/healthqna/part/view/C0000468925
폐결절,2019.06.29,"건강검진상 비활동성 폐결핵이 있다 나왔는데요
(추적검사는 필요하지 않다고함)

근데 제가 원래폐결절 조그마한게 있었는데
이게 비활동성 폐결핵으로 나올수 있나요???
즉 비활동성 피결핵이라고 나오면 폐결절이 있다고 보면되나요?",김지우 [의사],"안녕하세요. 하이닥 상담의 김지우입니다.
폐결핵균이 몸안에 잠복해 있다는 뜻입니다.
폐결절과는 관계없을 확률도 높아요.
폐결절 크기 변화가 있다면 암일 수도 있습니다.

폐결절 크기 변화가 없다고 해도 일반 양성 종양이라서 결핵과 관계 없을 수도 있어요.",https://www.hidoc.co.kr/healthqna/part/view/C0000469030
폐결절,2019.06.29,"건강검진상 비활동성 폐결핵이 있다 나왔는데요
(추적검사는 필요하지 않다고함)

근데 제가 원래폐결절 조그마한게 있었는데
이게 비활동성 폐결핵으로 나올수 있나요???
즉 비활동성 피결핵이라고 나오면 폐결절이 있다고 보면되나요?",김지우 [의사],"안녕하세요. 하이닥 상담의 김지우입니다.
폐결핵균이 몸안에 잠복해 있다는 뜻입니다.
폐결절과는 관계없을 확률도 높아요.
폐결절 크기 변화가 있다면 암일 수도 있습니다.

폐결절 크기 변화가 없다고 해도 일반 양성 종양이라서 결핵과 관계 없을 수도 있어요.",https://www.hidoc.co.kr/healthqna/part/view/C0000469030
명치가 꿀렁거리면서 헛기침이 납니다.,2019.06.28,"안녕하세요 20대 후반인 남자입니다.
최근에 계속 명치가 꿀렁거리면서 헛기침도 나고 불안한 증세가 많이 듭니다.

1년전에는 빠른 맥박과 가슴 통증으로 인해
아산병원 심장내과에 들려 정밀검사를 받았는데 심전도, 피검사, 24시간 홀터검사 모두 정상이였습니다

그 후 한 달 간 진료 후 공황장애라는 진단을 받았습니다.

이후 7~8개월 동안 약을 먹고 있었는데
최근 같은 증상은 약 1~2달 정도 되었습니다

공황장애에도 이런 증상이 있다고는 하는데 공황증상이 아니라
'위경련'위 관련질환'부정맥'조기수축' 이런것과도 관련이 있나요?
1년전에 정상 판정 받았는데 다시 재검사를 받아보는 것도 나쁘지 않나요?

아니면 공황장애라는걸 인지하고 잘 이겨내야 하는지 묻고 싶습니다
최근에 좀 소화가 안되고 더부룩한 증상이 많았습니다 식도염 같은 증상도 1~2번 있었습니다.",현일식 [전문의],안녕하세요. 하이닥 소화기내과 상담의 현일식입니다.,https://www.hidoc.co.kr/healthqna/part/view/C0000468875
폐섬유종(폐결절)이 간질성폐질환 인가요??,2019.06.29,"폐섬유종(폐결절)이 간질성폐질환 인가요??
그리고 폐결절과 간질성폐질환은 연관이있나요?",한재병 [전문의],안녕하세요. 하이닥 응급의학과 상담의 한재병입니다.,https://www.hidoc.co.kr/healthqna/part/view/C0000468938
7세아이 수족구.기존 가래많은상태.집에서 호흡기치료 풀라톤 가능 유무 ?,2019.06.29,"집에서 네블라이저로 호흡기치료 풀미칸 해줘도 되는지 궁금해요.
가래가 평소에도 있어서 기침해서 뱉는게 일상이 될 정도예요.",한재병 [전문의],안녕하세요. 하이닥 응급의학과 상담의 한재병입니다.,https://www.hidoc.co.kr/healthqna/part/view/C0000468925
폐 섬유화 증상인가요?,2019.06.27,"폐 섬유화가 폐가 딱딱해지는 거짆아요
1.그럼 이병을 앓는 사람들은 폐가 딱딱해지는걸 느낄수있나요?
가끔 폐쪽이 딱딱해지는 느낌이 드는데 궁금합니다.

2.일반 가슴 x레이 , 저선량ct를 찍으면 초기 폐 섬유화도 알수있는지요?",한재병 [전문의],안녕하세요. 하이닥 응급의학과 상담의 한재병입니다.,https://www.hidoc.co.kr/healthqna/part/view/C0000468779
간질성폐질환 초기,2019.06.27,"간질성폐질환 초기에도 엑스레이 찍으면 나오나요?
아니면 초기여도 안나타나는지 궁금합니다

그리고 제가 8년째 마른기침중이고 엑스레이는 정상인데
간질성폐질환은 증상이 수년까지 지속될수 있다들었는데
8년동안 이렇게 유지될수 있나요?",한재병 [전문의],안녕하세요. 하이닥 응급의학과 상담의 한재병입니다.,https://www.hidoc.co.kr/healthqna/part/view/C0000468781
명치가 꿀렁거리면서 헛기침이 납니다.,2019.06.28,"안녕하세요 20대 후반인 남자입니다.
최근에 계속 명치가 꿀렁거리면서 헛기침도 나고 불안한 증세가 많이 듭니다.

1년전에는 빠른 맥박과 가슴 통증으로 인해
아산병원 심장내과에 들려 정밀검사를 받았는데 심전도, 피검사, 24시간 홀터검사 모두 정상이였습니다

그 후 한 달 간 진료 후 공황장애라는 진단을 받았습니다.

이후 7~8개월 동안 약을 먹고 있었는데
최근 같은 증상은 약 1~2달 정도 되었습니다

공황장애에도 이런 증상이 있다고는 하는데 공황증상이 아니라
'위경련'위 관련질환'부정맥'조기수축' 이런것과도 관련이 있나요?
1년전에 정상 판정 받았는데 다시 재검사를 받아보는 것도 나쁘지 않나요?

아니면 공황장애라는걸 인지하고 잘 이겨내야 하는지 묻고 싶습니다
최근에 좀 소화가 안되고 더부룩한 증상이 많았습니다 식도염 같은 증상도 1~2번 있었습니다.",현일식 [전문의],안녕하세요. 하이닥 소화기내과 상담의 현일식입니다.,https://www.hidoc.co.kr/healthqna/part/view/C0000468875
트랙터 코커스 ( 폐렴 ),2019.06.27,"저희 어머니께서 폐렴에 걸리셨는데
간호사님께서 배양 결과 트랙터 코커스에 의한 폐렴이라고 말씀하시고, 레보록신정을 복용하면 5~7일 사이에 낫는다고 말씀하시더라고요.

근데 입원하신 기간이 2주가 거의 다되가고 있어서 불안해서 이렇게 질문드립니다.

1. '트랙터 코커스' 라는 것은 세균인가요? 바이러스인가요? 네이버에 쳐봐도 나오지가 않네요.

2. '트랙터 코커스' 위험한 미생물인가요?

3. '트랙터 코커스' 에 의한 폐렴으로 '레보록신정' 을 복용한 환자의 경우 환자마다의 차이는 분명 있겠지만 이론적으로 간호사님의 말대로 5~7일 정도 지나면 회복되시나요?

간호사님께서도 5~7일은 정확한게 아니라 대략적인거라서 주치의 선생님의 의견과 다를수 있다고 하셨어서 확인차 질문 드립니다.



마음 같아서 병원에 가서 보호자 면담을 신청하고 싶지만 이번주동안은 주치의 선생님이 오전에만 진료를 보시는 바람에 찾아뵙지를 못하고, 유선상으로는 전해드릴수 없는 말씀이라며 하셔서 이렇게 하이닥에 질문 올리게 되었습니다.",김소연 [전문의],"안녕하세요. 하이닥 내과 상담의 김소연입니다.

트렉터 코커스가 아니라 스트렙토 코쿠스 streptococcus가 아닐까요?
어찌되었든 균주가 자랐고 폐렴이 임상적으로 맞으면 대게는 면역 저하 환자가 아닐경우 레보프록사신 을 먹거나 주사로 맞으면 호전되는 경우가 대부분입니다.
대개 1주일에서 2주정도 치료 기간을 잡구요.
어머니의 증상이 호전 경과 중이라면 걱정하지 마시고 지켜보셔도 되겠습니다.
스트렙토 코쿠스는 세균이구요 세균성 폐렴으로 생각됩니다.

감사합니다. ",https://www.hidoc.co.kr/healthqna/part/view/C0000468606
만성 부비동염,2019.06.26,"만성 부비동염이에요.
아목사실린먹고, 스프레이 3주 정도 이용했습니다.
후비루 증상은 많이 호전 되었어요.
그런데, 연하 장애가 생셨어요. 침을 넘길 때 , 목이 아프고 불편합니다. 목이 아픈건 어떤 종류의 항생제를 먹어야 하나요? ( 아니면, 아목사실린을 계속 먹어야 할까요?)",전성호 [전문의],"안녕하세요, 하이닥 이비인후과 상담의 전성호 입니다.

목의 통증이 불편하여 질문하신 것으로 보입니다.

목이 아프다고 모두 항생제가 필요한 것은 아닙니다. 통증의 원인을
찾아보고 알맞는 약을 복용하는 것이 좋습니다.

부비동염의 호전된 상태와 후비루의 정도, 목의 통증 원인 등을 참고하여
복용중이던 항생제를 계속 사용하여야 하는지, 다른 항생제가 필요한 것인지,
다른 종류의 약이 필요한 것은 아닌지 등을 상의하는 것이 좋겠습니다.

답변이 좀 도움이 되었는지요?
감사합니다.

( 이와 같은 답변은 참고사항이며, 법적인 책임이 동반되는 용도로 사용될 수 없습니다.
또한 정확한 검진과 판단은 이비인후과 진찰을 받고 전문의와 상의하여야 합니다. )",https://www.hidoc.co.kr/healthqna/part/view/C0000468469
