title,date,question,doctor,answer,url
고양이 알레르기 치료,2021.03.18,"안녕하세요. 제 와이프가 고양이 알르레기가 있습니다.
저, 와이프 모두 고양이를 파양하고 싶지 않고 끝까지 책임을 지고 싶으나
와이프가 고양이 알르레기가 점점 심해지고 있어 문의글을 남깁니다.

문의드릴 내용은 3가지입니다.

1. 고양이와 같이 생활하면서 면역치료가 가능한가요?
2. 임신 계획이 있는데 치료후에 임신에는 문제가 없을까요?
3. 알르레기 치료에 있어 부작용은 어떻게 되나요?

감사합니다.",조병현 [전문의],"안녕하세요. 하이닥 내과 상담의 조병현입니다.
원칙적으로 알러지의 치료는 회피입니다.
고양이 알러지가 있다면 원칙적으로 고양이와의 접촉을 금해야 합니다.
면역치료도 일반적으로 알러지 항원에 대해 적응 농도부터 조금씩 농도를 높여가며
감작시키는 것이기 때문에 현실적으로 같이 생활하면서 진행은 어려울 것으로 생각됩니다.
대학병원의 알러지 내과를 방문하여 치료법을 상담받아보는 것이 좋겠습니다.",https://www.hidoc.co.kr/healthqna/part/view/C0000589301
고양이 알레르기 치료,2021.03.18,"안녕하세요. 제 와이프가 고양이 알르레기가 있습니다.
저, 와이프 모두 고양이를 파양하고 싶지 않고 끝까지 책임을 지고 싶으나
와이프가 고양이 알르레기가 점점 심해지고 있어 문의글을 남깁니다.

문의드릴 내용은 3가지입니다.

1. 고양이와 같이 생활하면서 면역치료가 가능한가요?
2. 임신 계획이 있는데 치료후에 임신에는 문제가 없을까요?
3. 알르레기 치료에 있어 부작용은 어떻게 되나요?

감사합니다.",조병현 [전문의],"안녕하세요. 하이닥 내과 상담의 조병현입니다.
원칙적으로 알러지의 치료는 회피입니다.
고양이 알러지가 있다면 원칙적으로 고양이와의 접촉을 금해야 합니다.
면역치료도 일반적으로 알러지 항원에 대해 적응 농도부터 조금씩 농도를 높여가며
감작시키는 것이기 때문에 현실적으로 같이 생활하면서 진행은 어려울 것으로 생각됩니다.
대학병원의 알러지 내과를 방문하여 치료법을 상담받아보는 것이 좋겠습니다.",https://www.hidoc.co.kr/healthqna/part/view/C0000589301
질문 좀 드립니다 1 알레르기 일경우 항히스타민제를 먹으면 증상이 사라지나요,2021.03.14,1 알레르기 일경우 항히스타민제를 먹으면 증상이 사라지나요,송슬기 [전문의],"안녕하세요. 하이닥 외과 상담의 송슬기입니다.
증상이 호전될 수 있습니다. 답변을 참고하시기 전에 1. 온라인 상에서의 답변은 제한적인 정보에 따른 견해로 법적인 책임이 없는 참고 정보로만 고려해주세요.2. 정확한 의학적 검진과 판단은 가까운 병원에 방문하셔서 전문의에게 들으시기 바랍니다.",https://www.hidoc.co.kr/healthqna/part/view/C0000588369
아토피 아이 팬더눈,2021.02.26,"22개월 아기 아토피 발병한지 3개월 됐어요
다리 접히는 부위만 심해요
또 다른 증상은 한쪽눈이 팬더 눈처럼 주위가 거뭇거뭇해요
자주 충혈되고 비비고 아프다고 하네요
그리고 코도 자주 막히구요
이게 무슨 알레르기 증상인가요?
아니면 아토피면 이런 증상이 동반하는건가요??",최용원 [전문의],"안녕하세요. 하이닥 피부과 상담의 최용원입니다.

아기 아토피피부염으로 걱정이 되시겠습니다.
눈 주위 팬더 모양은, 비염으로 인한 울혈때문에 혈관이 비쳐 보이는 증상으로 보입니다.
눈 근처의 아토피피부염 양상은 현재 보이지 않으나, 눈 주변에도 호발하는 부위임으로 잘 관찰하는 것이 좋겠습니다.

아토피피부염, 알레르기 비염, 천식은 알레르기 3형제로 같이 잘 동반할 수 있습니다.
아토피피부염, 비염이 있으므로, 아기가 어떤 알레르기가 있는지 추후 피검사 등으로 확인하는 것이 도움이 될 것으로 보이며, 비염약을 복용함으로 눈 주위 울혈은 완화시킬 수 있을 것으로 보입니다.
다리 주변 습진도 꽤 있는 상태로, 피부과 전문의 선생님 진료를 받는 것은 권유드립니다.",https://www.hidoc.co.kr/healthqna/part/view/C0000584512
알레르기성 비염이면 어디가서 치료 받아야 되나요?,2021.02.26,"마스트 알러지 검사 해봤는데 아무것도 안 나왔어요 ㅠㅠ
피부과도 다니고 있어요
그런데 알레르기성 비염이면 어디가서 치료 받아야 되나요?
이비인후과 가야 해나요 아니면 소아과 가야 해나요??
피검사도 더 정밀한 알러지 검사 해봐야 하나요 ??",이성호 [전문의],"안녕하세요. 하이닥 이비인후과 상담의 이성호입니다.

아직 아이가 어려서 알레르기가 확립될 연령은 아닐 것으로 생각됩니다. 만 4-5세경 다시 마스트 검사는 해보실 필요가 있을 것 같습니다. 마스트에서 아무 것도 안 나왔다고 알레르기를 완전 배제할 수 없는 점도 알고 계시면 좋을 듯 합니다.
알레르기성 비염은 이비인후과 소아청소년과 모두 진료가 가능한 질환입니다. 지금은 아이가 어려서 검사보다는 증상과 질환에 맞는 적합한 치료를 해주시고 조금 더 성장한 뒤 마스트 재검사를 고려해보시기 바랍니다.

감사합니다.",https://www.hidoc.co.kr/healthqna/part/view/C0000584600
밀알러지 면역치료,2021.02.25,"제가 어렸을때 아토피는 가볍게 지나갔었고요..
중학교때부터 비염과 알레르기성 결막염 생겼고 20살때부터 밀음식먹고 종종 두드러기 났었다가 작년 26살에 아나필락시스가 와서 알레르기 내과에가서 검사 후 천식이랑 밀의존성 운동유발성 아나필락시스를 진단받았어요..(흡입엔 알러지 반응 없고 먹을때만 알러지 반응 납니다)
지금 천식치료는 받고 있는 중이고 혹시 밀 의존성 운동 유발성 아나필락시스도 혹시 면역치료에 도움 받을 수 있나요?ㅠㅠ
영양사로 일 구해야 하는데 불편해서요ㅠㅠ",홍인표 [전문의],"안녕하세요. 하이닥 가정의학과 상담의 홍인표입니다.
많이 불편하시겠네요. 그냥 밀인가요? 아니면 글루텐 ? 이런 건가요? 제가 알기로는 아직까지는 국내에는 치료법이 아직 소개되지 않은 것으로 알고 있습니다.",https://www.hidoc.co.kr/healthqna/part/view/C0000584367
알레르기성 비염이면 어디가서 치료 받아야 되나요?,2021.02.26,"마스트 알러지 검사 해봤는데 아무것도 안 나왔어요 ㅠㅠ
피부과도 다니고 있어요
그런데 알레르기성 비염이면 어디가서 치료 받아야 되나요?
이비인후과 가야 해나요 아니면 소아과 가야 해나요??
피검사도 더 정밀한 알러지 검사 해봐야 하나요 ??",이성호 [전문의],"안녕하세요. 하이닥 이비인후과 상담의 이성호입니다.

아직 아이가 어려서 알레르기가 확립될 연령은 아닐 것으로 생각됩니다. 만 4-5세경 다시 마스트 검사는 해보실 필요가 있을 것 같습니다. 마스트에서 아무 것도 안 나왔다고 알레르기를 완전 배제할 수 없는 점도 알고 계시면 좋을 듯 합니다.
알레르기성 비염은 이비인후과 소아청소년과 모두 진료가 가능한 질환입니다. 지금은 아이가 어려서 검사보다는 증상과 질환에 맞는 적합한 치료를 해주시고 조금 더 성장한 뒤 마스트 재검사를 고려해보시기 바랍니다.

감사합니다.",https://www.hidoc.co.kr/healthqna/part/view/C0000584600
아토피 아이 팬더눈,2021.02.26,"22개월 아기 아토피 발병한지 3개월 됐어요
다리 접히는 부위만 심해요
또 다른 증상은 한쪽눈이 팬더 눈처럼 주위가 거뭇거뭇해요
자주 충혈되고 비비고 아프다고 하네요
그리고 코도 자주 막히구요
이게 무슨 알레르기 증상인가요?
아니면 아토피면 이런 증상이 동반하는건가요??",최용원 [전문의],"안녕하세요. 하이닥 피부과 상담의 최용원입니다.

아기 아토피피부염으로 걱정이 되시겠습니다.
눈 주위 팬더 모양은, 비염으로 인한 울혈때문에 혈관이 비쳐 보이는 증상으로 보입니다.
눈 근처의 아토피피부염 양상은 현재 보이지 않으나, 눈 주변에도 호발하는 부위임으로 잘 관찰하는 것이 좋겠습니다.

아토피피부염, 알레르기 비염, 천식은 알레르기 3형제로 같이 잘 동반할 수 있습니다.
아토피피부염, 비염이 있으므로, 아기가 어떤 알레르기가 있는지 추후 피검사 등으로 확인하는 것이 도움이 될 것으로 보이며, 비염약을 복용함으로 눈 주위 울혈은 완화시킬 수 있을 것으로 보입니다.
다리 주변 습진도 꽤 있는 상태로, 피부과 전문의 선생님 진료를 받는 것은 권유드립니다.",https://www.hidoc.co.kr/healthqna/part/view/C0000584512
아기 피검사 결과 문의드립니다.,2021.02.23,"지금 15개월 접어드는 남자 아이입니다.
38주차에 자연분만으로 정상 분만했고, 황달기가 있어 광선치료 1회
그뒤로는 소소한 감기만 걸렸을 뿐 크게 아픈건 아토피 피부밖에 없는데요.
어린이집 입소 관련하여 알레르기 항목 적는거 관련해서 서류를 찾던중
9개월에 MAST검사 결과지를 보다보니 궁금한게 있어서 문의드립니다.
아기가 알러지도 있고, 아토피도 있어 9개월에 마스트 검사를 진행했는데요.
그때 알러지 항목만 관련해서 feedback을 받고 다른 항목은 크게 신경안썼는데..
지금 보다보니 수치가 이상한것들이 있어서 문의드립니다.

MPV 9.1 fL
P-LCR 17.9%
seg.neutrophill 9.8%
lymphocyte 79.7%
platelet distribution Width 9.5 fL

이항목들이 정상범위에서 벗어나 있던데.. 그때는 피부과 의사쌤이라 이런항목들에 대해 크게 검토를 안하신건지
아님 크게 신경쓰지 않아도될 수준인지 모르겠어서요..
다른건 spec에서 크게 벗어나지 않는데 lymphocyte의 경우 참고치와 차이 많이나는데
다시 피검사를 해봐야할까요?",박상학 [전문의],"안녕하세요. 하이닥 소아청소년과 상담의 박상학입니다.
일별해 보면, lymphocyte(임파구) 수치가 약간 높은 것 말고는 큰 이상 없습니다. 이 임파구는 만성질환시 일시적으로 올라갈 수 있다고 하는데.... 큰 임상적 의의는 없습니다. 급성병증일 때 WBC(백혈구) 수치가 10000을 넘어가면 여러 다른 검사가 필요하겠으나, 본 아기의 경우는 아토피가 있으니까 임파구 분포 %가 다소 올라갈 수 있겠습니다.
아토피 관리를 잘 하시면 되리라 생각합니다.",https://www.hidoc.co.kr/healthqna/part/view/C0000583865
"항히스타민제 에대하여,,,",2021.02.19,"안녕하세요 해외거주 주부입니다
갑자기 아침에 손가락과 발가락이 미치도록가렵다가 가라안고해서 그려려니했는데
저녁부터 몸에 여기저기 모기물린것처럼 콩알만하게 올라오더니 가렵고 조그마하던게 점점커지고
번져서 씨잘(레보세테리진) 을 한알먹고 자고 일어나니 괜찮아졌습니다

1)이럴경우 게속 약을먹어야하나요 아니면 그만 먹어도 되나요
2)만약 계속 먹어야한다면 끊을때 갑자기끊어야 하나요?
3)약을 끊는 방법을알려주시면 감사하겠습니다
4) 오늘처럼 한번먹고 괜찮을땐 그만먹어야하나요? 아니면 하루건너 몇일간먹어야하나요?
5) 저의 증상이 갑자기 무슨 증상일까요?",한재병 [전문의],"안녕하세요. 하이닥 응급의학과 상담의 한재병입니다.

환자를 대면진료하지 않고 정확한 답을 드리기는 어려우나, 이유는 파악되지 않은 상태의 알러지 반응 가능성이 높아보입니다. 상태가 많이 심할때라면 응급실 방문이 필요할 수 있으며, 약제는 그만 복용하셔도 될듯합니다.",https://www.hidoc.co.kr/healthqna/part/view/C0000583270
항히스타민제 재질문입니다,2021.02.19,"약을 갑자기끊으면 다시증상이 나온다고 알고잇습니다
하루나 이틀정도 먹었을경우에는 그냥끊어도괜찮을지요
더심해질까봐요",손정민 [약사],"안녕하세요. 하이닥 상담약사 손정민입니다.

알레르기를 일으키는 물질이 체내에 있으면 계속 알레르기 반응이 나타날 수있어서
몇일 드시다가 일시적인 피부알레르기 현상이라면 증상이 완화된 후 중단하셔도 괜찮아보입니다.
따로 끊어야 하는 시점이 정해져 있는건 아닙니다.

답변이 도움이 되셨는지요? 감사합니다:)",https://www.hidoc.co.kr/healthqna/part/view/C0000583274
항히스타민제,2021.02.19,"안녕하세요 해외거주 주부입니다
갑자기 아침에 손가락과 발가락이 미치도록가렵다가 가라안고해서 그려려니했는데
저녁부터 몸에 여기저기 모기물린것처럼 콩알만하게 올라오더니 가렵고 조그마하던게 점점커지고
번져서 씨잘(레보세테리진) 을 한알먹고 자고 일어나니 괜찮아졌습니다

1)이럴경우 게속 약을먹어야하나요 아니면 그만 먹어도 되나요
2)만약 계속 먹어야한다면 끊을때 갑자기끊어야 하나요?
3)약을 끊는 방법을알려주시면 감사하겠습니다
4오늘처럼 한번먹고 괜찮을땐 그만먹어야하나요? 아니면 하루건너 몇일간먹어야하나요?",손정민 [약사],"안녕하세요. 하이닥 상담약사 손정민입니다.

항히스타민 제제의 경우 증상에 따라 조절해서 드시면 됩니다.
증상이 좀 남아있다면 몇일 더 드셔도되고, 괜찮아지셨으면 안드셔도 될 것같습니다.
다만 알레르기 반응이 약 드시고도 계속 지속되면 원인이 무엇인지 살펴보시고, 최대한 피하시는 것이 좋습니다.

답변이 도움이 되셨는지요? 감사합니다:)",https://www.hidoc.co.kr/healthqna/part/view/C0000583268
알레르기는 유전이 되나요?,2021.02.17,"알레르기는 치료가 되나요?
알레르기는 유전이 되나요?",홍인표 [전문의],"안녕하세요. 하이닥 가정의학과 상담의 홍인표입니다.
어떤 알레르기고 얼마나 심하느냐에 따라다르지만 알러지 비염 같은 알러지는 유전 성향이 있을 수 있으며 열심히 조절하면 치료 가능합니다 .",https://www.hidoc.co.kr/healthqna/part/view/C0000582698
몇년째 마른 기침을 하고 있습니다.,2021.02.08,"언제 처음 그랬는지는 정확히 알수없으나 수년째 최소 10년은 넘은걸로 기억합니다. 과거에는 겨울철이나 환절기에만 그랬는데 현재는 계속 하게되고 병원진료나 약을 처방 받아봐도 호전이 되지않아 여기에도 물어보게되었습니다.
증상은 목안쪽에 이물질이 있는것처럼 간질간질해서 제가 그 간지러움을 없애려고 하는 기침으로 하루에도 수십번씩하게되고 대학병원에서 코, 입으로 카메라를 넣어 확인했을때 가래는 없고 깨끗하다고 하고 목에 회색빛이 나야되는 부분이 빨간색인게 혹시 역류성식도염 때문일수도 있다고 하여 약을 먹었으나 전혀 차도는 없었습니다. 직업이 군인이다보니 다른병원에 방문하기도 자주 진료를 받기도 제한되어 혹시나 하는 마음에 글을 적어봅니다. 대학병원에도 3회정도 방문하고 약도 꾸준히 먹어보았는데 병원을 간다면 무슨과를 가야될지도 막막하여 답변주시면 감사하겠습니다",송슬기 [전문의],"안녕하세요. 하이닥 외과 상담의 송슬기입니다.
알러지 호흡기 내과이며 흉부 CT 촬영도 해보세요 .
답변을 참고하시기 전에 1. 온라인 상에서의 답변은 제한적인 정보에 따른 견해로 법적인 책임이 없는 참고 정보로만 고려해주세요.2. 정확한 의학적 검진과 판단은 가까운 병원에 방문하셔서 전문의에게 들으시기 바랍니다.",https://www.hidoc.co.kr/healthqna/part/view/C0000580681
생리통약 동시 복용 가눙한가요?,2021.02.10,"펙소나딘정 저녁 1회 7일
에보프림연질캡슐 아침 2회 저녁 2회 7일

이렇게 먹고있는데 이지엔 이브 같이 먹어도 될까요?
생리통이 너무 심해서요.",유동성 [약사],"안녕하세요. 하이닥 상담약사 유동성입니다.
크게 알려진 상호작용은 없습니다. 같이 드셔도 무방할 것으로 보입니다.
주기때 마다 생리통이 심하신 분들은 생리통이 시작될 때 드시기보다는 1~2일 전에 미리 드시는것이 더 효과적입니다.",https://www.hidoc.co.kr/healthqna/part/view/C0000581096
몇년째 마른 기침을 하고 있습니다.,2021.02.08,"언제 처음 그랬는지는 정확히 알수없으나 수년째 최소 10년은 넘은걸로 기억합니다. 과거에는 겨울철이나 환절기에만 그랬는데 현재는 계속 하게되고 병원진료나 약을 처방 받아봐도 호전이 되지않아 여기에도 물어보게되었습니다.
증상은 목안쪽에 이물질이 있는것처럼 간질간질해서 제가 그 간지러움을 없애려고 하는 기침으로 하루에도 수십번씩하게되고 대학병원에서 코, 입으로 카메라를 넣어 확인했을때 가래는 없고 깨끗하다고 하고 목에 회색빛이 나야되는 부분이 빨간색인게 혹시 역류성식도염 때문일수도 있다고 하여 약을 먹었으나 전혀 차도는 없었습니다. 직업이 군인이다보니 다른병원에 방문하기도 자주 진료를 받기도 제한되어 혹시나 하는 마음에 글을 적어봅니다. 대학병원에도 3회정도 방문하고 약도 꾸준히 먹어보았는데 병원을 간다면 무슨과를 가야될지도 막막하여 답변주시면 감사하겠습니다",송슬기 [전문의],"안녕하세요. 하이닥 외과 상담의 송슬기입니다.
알러지 호흡기 내과이며 흉부 CT 촬영도 해보세요 .
답변을 참고하시기 전에 1. 온라인 상에서의 답변은 제한적인 정보에 따른 견해로 법적인 책임이 없는 참고 정보로만 고려해주세요.2. 정확한 의학적 검진과 판단은 가까운 병원에 방문하셔서 전문의에게 들으시기 바랍니다.",https://www.hidoc.co.kr/healthqna/part/view/C0000580681
모든종류의 항생제 알러지 검사할수 있나요?,2021.02.03,"20년전에 크라목스정 이라는 페니실린계 항생제를 복용 후 온몸에 두드러기가 났고 이후 10여년동안 만성두드러기로 치료를 받았습니다
크라목스정을 복용 전에 페니실린계 항생제를 복용했었는지 안했었는지는 모르겠습니다
당시에 알레르기비염으로 한달정도를 이비인후과에서 치료를 했는데 잘 났지않아 항생제를 다른종류로 바꿔준다고 하여 복용했고 그리고 바로 온몸에 두드러기가 나는 알러지 반응이 일어났습니다
두드러기가 나서 해당 이비인후과에 내원하여 상황설명을 하니 기존에 복용하던 약은 다 동일했고 항생제만 크라목스정으로 변경했다고 크라목스정때문에 알러지 반응이 일어난거라 하여 저는 항상 병원에서 항생제 처방시에 페니실린계 항생제에 알러지있다고 알립니다
10여년동안 만성두드러기로 치료받는 중에 대학병원 알레르기 내과에서 혈액검사로 알레르기 검사를 해본적이 있습니다
완전한 알레르기는 아니지만 갑각류에 대한 반응이 약간있다고 하면서 혹시 갑각류 먹고 알러지 반응 있었는지 물어보더군요
한번도 그런적이없어서 그런적없다고 말씀드리니 그럼 문제없다고 했는데 저는 지금까지도 갑각류를 먹고는 있지만 항상 찜찜한 기분은 듭니다

제가 병원에서 항생제를 처방받아야할 상황이되면 페니실린계 항생제 알러지있다고 말씀드리면 대부분 병원에서 세파클러나 록시트로마이신 성분의 항생제를 처방해주더군요 대부분 세파클러 입니다
저는 세파클러도 페니실린계와 동일한 베타락탐계라는건 한참뒤에 알았습니다
항생제를 먹을일은 잘 없지만 대부분 항생제 먹을일이 생기면 세파클러를 주로 병원에서 처방해줬기에 복용했었고
그때마다 문제는 없었습니다

근데 몇해전에 우연히 병원에서 항생제 처방받다가 의사선생님께서 세파클러도 페니실린계와 같은 계열이라고 혹시 복용 후에 알러지 반응이 생길수있으니 잘관찰하여라라고 주의를 주게되면서 세파클러도 페니실린계와 같은 계열이란것을 알고 난뒤부터는 항상 복용할때마다 걱정이 됩니다

또 이상한일이 한번 있었는데 감기로 이비인후과에 가서 항생제 처방받는데 분명히 페니실린계 항생제 알러지가있다고 말씀드렸는데 착각을 하신건지 실수를 하신건지 크라목스정과 동일한 성분의 아목시실린 항생제를 처방 해주신겁니다
저는 그때 처음 크라목스정 복용 후 두드러기난날로부터 10여년이 지난 상황이라 저도 조금 착각하고 아무생각없이 복용을 했습니다 근데 아무 이상이 없는겁니다 1회복용하고 바로 알아채서 그 이후에 복용은 안했는데 당시에 크라목스정을 복용하고 알러지 반응이 일어난게 맞는지 의문이 들더군요

그래서 확실하게 현재 시판중인 모든 종류의 항생제에 대하여 알러지가 있는지 없는지 대학병원의 알레르기 내과에가면 확실히 검사를 할수 있나요? 병원에 입원하게되면 팔에 행상제 주사를 살짝 놓아서 알러지 반응있는지 없는지 확인하던데 그런식의 방법으로 검사를 하게되는지 혈액검사로 알아본다든지 확실하게 어떤 종류의 항생제의 알러지가 있는지 없는지 확인해볼수있나요?",홍인표 [전문의],"안녕하세요. 하이닥 가정의학과 상담의 홍인표입니다.
대학병원 알러지 내과에 가시면 어느정도까지는 항생제 알러지에 대한 검사를 받으실 수 있을 것으로 생각합니다.
검사 결과와 실제 알러지 반응과 일치하지 않는 경우도 있기는 합니다.",https://www.hidoc.co.kr/healthqna/part/view/C0000579738
고양이 알레르기 없앨 수는 없나요,2021.01.13,조만간 고양이를 키우는데 고양이 알레르기가 있어요 재채기와 콧물이나오고 얼굴도 조금 가렵습니다 어렸을때 후천적으로 생긴거라 알레르기 없앨 수는 없나요? 고양이를 정말 좋아해서 꼭 키우고싶어요..!,홍인표 [전문의],"안녕하세요. 하이닥 가정의학과 상담의 홍인표입니다.
알레르기 질환 치료에서 가장 중요한 첫번째가 알레르기를 일으키는 물질 요인 상황을 피할수 있으면 피하는 것입니다. 어쩌죠?  조금 멀리하시는 것이 좋을것 같습니다.",https://www.hidoc.co.kr/healthqna/part/view/C0000575289
약 복용 관련 문의드립니다.,2021.01.12,"첨부한 약을 저녁에 복용하고 얼마 후에 손등과 팔 쪽이 가려워서 봤더니 사진과 같이 조금씩 붉게 올라왔습니다. 다행히 자고 일어났더니 괜찮아졌는데요.
전에도 항생제를 복용하면 몸이 자주 가려웠는데.. 이렇게 피부까지 붉게 올라온 건 처음입니다.
나중에 항생제를 처방받게 되었을 때 말씀을 드려야 하는지.. 어느 정도 가려움은 감수하고 먹어야 하는 건지 모르겠습니다.",손정민 [약사],"안녕하세요. 하이닥 상담약사 손정민입니다.

우선 항생제로 인한 피부 부작용인지 확인해보아야 할 것 같습니다. 이전에도 항생제 복용 후 가려웠다고 하셔서, 약으로 인한 것이라면 복용을 중단하였을 때 그 증상이 사라질터인데요. 만약 약을 복용하시어 두드러기가 올라온다면 꼭 치료받으셨던 병원에 방문하시어 증상을 말씀하시고 다른 계열의 항생제로 요청 드릴 것을 권해드립니다. (항생제의 경우는 임의로 중단하면 안되기에 꼭 다시 방문해보세요.) 또한 내가 어떤 성분의 약을 먹었을 때 그런 증상이 나타나는지 아시고, 병원이나 약국에 가실 때마다 부작용이 나타나는 약 성분을 말씀 주셔야 안전하게, 그리고 효과적으로 약을 복용하실 수 있습니다 :)

답변이 도움이 되셨는지요? 감사합니다.",https://www.hidoc.co.kr/healthqna/part/view/C0000575047
