title,date,question,doctor,answer,url
자고 일어나면 목이 칼칼하고 불편합니다,2019.12.27,"자고 일어나면 목이 마치 목감기 초기처럼 칼칼하고 불편합니다

코골이는 하긴하지만 몇시간에 한두번씩 하는수준이구요

입벌리고 자는것같지는 않습니다

역류성식도염일까요?

아침에 일어났을때가 가장 불편하고 오후쯤되면 점점 괜찮아지긴하는데 그래도

불편감이 있습니다",정규화 [전문의],"안녕하세요. 하이닥 이비인후과 상담의 정규화입니다.

비염인 경우 인후 점막이 붓고 건조해지며 불편할 수 있습니다.
코골이 증상이 있는 경우 비염을 확인 해 보셔야 합니다 .
역류성 식도염인 경우도 추정 할 수 있습니다.
일상 생활의 개선이 필요하고 충분한 수분 섭취와 운동 요법이 도움이 됩니다.
비만에 대한 관리도 필요합니다. 과체중인 경우 비강 구강 점막 인후 점막의 부종으로 상기 증상이 초래 될 수 있습니다. 감사합니다.",https://www.hidoc.co.kr/healthqna/part/view/C0000489122
목젖에 상처가 생겼습니다,2019.12.30,"제목대로입니다
최근 독감에걸려서 열이심하고 기침이심해서
병원에서 주사한방맞고 괞찮아졌는데
목은 계속아프길래 거울로 보니까 상처가
아있더라고여

1. 근처에 내과있는데 거기서 진로받아도 되나요?

2. 심각한건가요?

3. 금방낳을까요?",홍인표 [전문의],"안녕하세요. 하이닥 가정의학과 상담의 홍인표입니다.

많이 힘드셨겠네요. 금년에 독감접종은 하셨죠?
1. 내과에서 진료 받으셔도 됩니다.
2. 심각할 것 같지는 않아요.
3. 금방 좋아지실 겁니다. 푹쉬셔요. 잘 드시고요.",https://www.hidoc.co.kr/healthqna/part/view/C0000489487
최근 운동 중 극심한 피로와 어지러움. 가슴답답함,2019.12.30,"34살 남성입니다 지난 10달부터 운동을 하면 운동중에 피로가 몰려오고 어지럽고. 가끔가다가 호흡곤란이 옵니다. 과거 2017년 11월쯤에 가습답답함이 몰려와 가까운 의원급 병원에서 1년가까이 약물치료로 받다가 작년 2018년 11월에 근처 종합병원에서 심장초음파,심전도,24시간 홀터검사,위내시경, 흉부엑스레이,혈액검사를 받았지만 아무 이상 없었고 올해 2019년도에만 심전도 검사를 추가적으로 두 번 더 받았습니다.아무 이상없고 그냥 과도한 스트레스로 인한 증상이라고 하면서 신경안정제를 몇개월간 먹었고 약을 서서히 줄여서 끊었지만 최근들어서 증상들이 점점 심해지는거 같은데 추가적으로 받을 검사가 있을까요?",홍인표 [전문의],"안녕하세요. 하이닥 가정의학과 상담의 홍인표입니다.

약을 줄이면서 증상이 나빠지는 것은 약을 줄일 만큼 호전되지 않은 상태에서 약을 줄인 것이 아닌가 싶네요.
다시 약을 조금 늘려야 하지 않을까 싶구요.
스트레스 많으신가요? 불안하거나 우울하거나 하시나요? 잠은 잘 주무시나요?",https://www.hidoc.co.kr/healthqna/part/view/C0000489470
방사선과 항암을 위해 몸 영양보충을 어떻게 하면 될까요,2019.12.27,"폐선암3기로 수술은 하였고 전이된 임파선 60회
머리뼈부분30회를 방사선과 항암치료를 해야 된다는데 사람마다 다 틀린다고 합니다만
먹는것도 많은 양을 먹지못하고 몸도약하여 이겨낼수 있을지가 염려가 되는 부분입니다
방사선과 항암치료하기전 먹는 음식과 몸관리를 어떻게 하면 좋을지 도움말씀 부탁드립니다",김소연 [약사],"안녕하세요. 하이닥 상담약사 김소연입니다.
머리뼈부분 방사선치료이면 뇌전이가 되었음을 전달 받으셨을 것으로 보입니다. 항암치료는 쉽지 않은 과정이므로 걱정이 많으실 것 같습니다. 항암치료 전 어떠한 준비를 하시더라도 치료 후 개인간 겪는 이상반응과 통증여부가 다양하여 치료진행 중 관리에 힘쓰시는 것이 더 중요할 것으로 보입니다. 필요한 사항 몇가지 기재해 드리면,
1. 세균감염에 주의- 조리도구 위생, 식품유통기간 확인, 날음식 주의
2. 위장에 부담없는 음식- 항암치료의 가장 흔한 부작용은 구토입니다. 메스꺼움 증상완하와 체력유지를 위해 자극적이지 않은 음식을 드시는 것이 좋습니다.
3. 충분한 숙면-항암치료 전후 면역증강을 위해 충분한 숙면에 도움이 되는 음식과 가벼운 운동 및 식습관이 중요합니다.",https://www.hidoc.co.kr/healthqna/part/view/C0000489170
담배 핀후 폐쪽이 아주 가끔 아픈느낌이 드는데,2019.12.27,담배를 3개월정도 피웠는데요 폐쪽이 아주 가끔 아픈느낌이 드는데 괜찬을까요? 숨쉴때는 괜찬습니다,류재열 [전문의],"안녕하세요. 하이닥 가정의학과 상담의 류재열입니다.

폐쪽에 문제가 있다고 해서 통증이 느껴지는 경우는 드뭅니다.
폐 문제인 경우에는 통증보다는 기침,가래,객혈이 나타나는 경우가 많습니다
폐 보다는 위, 식도, 심장, 근골격계의 문제일 가능성이 높으며 흡연 시작 후 증상이 있다면 안 피는 것이 좋습니다.
감사합니다.",https://www.hidoc.co.kr/healthqna/part/view/C0000489168
아이 가슴답답 과호흡증상,2019.12.28,"초3아이이구요
키 140 몸무게 33킬로정도 여자아이입니다
한달전부터 가슴이 답답하다그러구
최근엔 과호흡이 심해졌네요ㅠ
혹시 어떤검사를 해봐야되나요
심장초음파 심전도했구요 삼천판폐쇄부전이 약간있으나 이것땜에 답답하지는 않다했구요 심전도정상 엑스레이도 심장초음파하러갈때 찍었는데 공기차있거나 그러진않다하구요
오늘 복부초음파랑 피검사했어요

혹시 아이 과호흡의 원인으로 어떤것이 있으며
혹시 더 필요한 검사가있을까요ㅠ
아 청진소리도 괜찮대요",홍인표 [전문의],"안녕하세요. 하이닥 가정의학과 상담의 홍인표입니다.

무슨 스트레스 같은것이 없을까요?
검사에서 이상이없다면 심리적인 이유가 없는지 살펴봐야 합니다.
가족간의 문제, 친구사이의 문제, 학교생활 등등....",https://www.hidoc.co.kr/healthqna/part/view/C0000489253
하품을하면 시원하지않고. 자주끊켜요..,2019.12.26,3일전부터 하품을하면 하품이 시원하게안되고 중간에끊키더라고여... 그래서병원가니까 심전도.폐에는 이상없다는데.. 혹시 뇌에이상이있던지 다른곳에이상이있는지 걱정되네요.. 괜히이거생각하니까 스트레스받고 어질한느낌이들고있어오 .,주재형 [전문의],"안녕하세요. 하이닥 신경과 상담의 주재형입니다.

질문하신 증상은 질병의 증상으로 보이지는 않습니다. 뇌질환으로 인해 발생하는 증상의 가능성은 희박하므로 좀 더 경과를 지켜 보셔도 될 듯 합니다.",https://www.hidoc.co.kr/healthqna/part/view/C0000489007
팔.다리.몸이 따끔.찌릿하고 화끈거려요,2019.12.25,"어제밤부터 팔.다리.몸.가슴쪽이 갑자기 따끔.찌릿하고 팔쪽이 화끈하네요 안그랬었는데..신경과가서 진찰받야야할까요?
(11.12월달에는 두근거림 흉통증상으로 큰병원에서 심장검사 심전도.엑스레이.24시 심전도검사.심장초음파 조영제투여후 몸CT 머리MRI 검사했는데 이상없다네요ㅠㅠ)",김태형 [전문의],"안녕하세요. 하이닥 신경과 상담의 김태형입니다.

특별한 외상이나 피부병변없이 따끔거림, 찌릿한 감각, 화끈거리는 증상이 있다면 감각신경의 이상으로 발생하는 증상일 가능성이 높아 이런 증상이 있을 경우 신경과에서 진료를 받는 것이 맞습니다.
하지만 갑자기 발생한 점, 특정 부위의 증상이 아닌 전신(?)의 이상감각증상은 대부분 검사를 해도 특이 소견이 발견되지 않고 원인 질환을 알아내지 못하는 경우가 많습니다.
증상이 지속되는 경우 해당 증세를 조절하는 약제를 복용하면서 어느 정도 경과관찰을 하면 호전되는 경우가 많습니다.
혼자서 고민하지 마시고 가까운 신경과 전문의를 방문하여 상담받아보시는 것을 권유 드립니다.

답변이 도움이 되었기를 바랍니다. 감사합니다.",https://www.hidoc.co.kr/healthqna/part/view/C0000488910
걸으면 막 왼쪽으로 쏠리는 느낌을 받아서 걸음이 살짝 휘청거리고..뭐가 문제일까요??,2019.12.19,"몸이 붕떠있다가 왼쪽 가슴이랑 등쪽이 통증이 있다가 오른쪽 허벅지뒷쪽이 움찔거리다 왼쪽 무릎쪽 움찔거리다 왼쪽 등이 움찔거리다 코뒷쪽이 땡기고 그러다보니 목도 아프고 음식삼킬때도 갑자기 숨이 막히는 느낌 들다가 괜찮다가 오른쪽 등쪽에
가래끄는 느낌들다가 막 오른손이 떨리다가 오른발이 떨리다가
숨이 막 턱턱 막히는 느낌 들다가 가슴이 답답하다가 가슴에서 위로 막 그 열이 올라오는 느낌이 오다가말아버려서 답답하고
그리고서 일어나면 현기증이 날때가 있고 어지러운것도 있고
귀도 멍하고 코도 막혔다 안막혔다 걸으면 막 왼쪽으로 쏠리는 느낌을 받아서 걸음이 살짝 휘청거리고 다리에도 힘이 좀 없고
수액을 2번맞고 약도 먹고 잇는데 이증상은 안없어지네여;;
불안장애도 있는데..정신약은 지금 중단했어요 병원에서도 불안장애라고 하시고 피검사이상 없고 심장 이상없고 속아파서
위장약도 먹고 있어요",박종원 [전문의],"안녕하세요. 하이닥 신경과 상담의 박종원입니다.

불안장애가 있으면서 몸 전체의 자율신경이 과흥분되어있는 상태로 보입니다.
자율신경 중 교감신경이 과흥분 되면 미세혈액순환 부전으로 질문자님의 모든 증상이 설명됩니다.
또한, 자율신경의 과흥분으로 불안증상이 좀 더 심하게 느껴질 수 있습니다.
약에 의한 치료보다는 주사치료, 도수치료 등의 효과가 클 것으로 생각됩니다.",https://www.hidoc.co.kr/healthqna/part/view/C0000488312
폐결절,2019.12.26,어머니가 63세이십니다. 올해 건강검진에서 폐결절 4.2cm가 발견되었고 검진때 엑스레이사진으로 서울대병원에서 폐암가능성이 높다합니다. 의사분이 다시 엑스레이 찍고 보자고 하셔서 이틀전에 엑스레이 재촬영하고 다음주 화요일에 결과들으러갑니다. 어머니가 류마티스관절염이 있으신데 병원약을 최근1년동안 잘안드셨거든요 혹시 이 결절이 단순염증일수도 있는 걸까요?,윤장호 [전문의],"안녕하세요. 하이닥 비뇨의학과 상담의 윤장호입니다.

폐결절에 대한 질문이시네요.
63세 여성에게서 특별한 증상없이 4.2cm 의 결절이 보이는 경우는 흔치 않습니다.
엑스레이 사진을 다시 찍으실 것이 아니라 즉시 흉부 CT를 찍으시고 치료 방향을 정하시는 것이 좋겠습니다.
4.2cm 라면 폐암이라고 하더라도 빨리 치료 받으시면 완치 확률이 있습니다.
답변이 도움이 되었길 바랍니다.",https://www.hidoc.co.kr/healthqna/part/view/C0000488962
자꾸하품을하면 끊키고 하다말게되요. .,2019.12.25,이틀전부터 하품을하면 하다가 말거나 하다가끊키게되요..되게시원하지않고 맺히늕느낌이나더라고여.. 그래서 병원가서 심전도.폐에도이상이없다는데... 혹시 뇌나 다른기관에이상있는건가요?,홍인표 [전문의],"안녕하세요. 하이닥 가정의학과 상담의 홍인표입니다.

그럴 가능성은 매우 적어서 너무 신경을 많이 쓰지 않으시는 게 좋을듯 합니다.
너무 피곤하신 것 아닌가 싶네요. 잠은 잘주무시나요?",https://www.hidoc.co.kr/healthqna/part/view/C0000488923
흉부 복부CT,2019.12.24,"안녕하세요 저번에 글 올렸는데 기침계속 나오고 흉통이 있어서 규모가 좀 큰 종합병원에 내원하여서 저선량 흉부CT를 찍고 싶다고 했더니 그러지 말고 너무 걱정하시는거 같은데 조영제응 넣고 씨티를 찍어보고 이왕에 주시맞고 찍는거 복부CT도 찍어서 복부도 봅시다 하셔서 그럽시다 하고 검사 예약하고 나왔는데 흉부 하고 복부를 씨티촬영할경우 자세하게 어느장기를 볼수 있는건가요? 그리고 작은 염증까지 정확하게 나오나요?

그리고 그 전 건강검진에서 흉부 액스레이 결과 기관지염의증이라고 진단되어있는데 이거 빨리 치료받아야 되나요?",홍인표 [전문의],"안녕하세요. 하이닥 가정의학과 상담의 홍인표입니다.

기관지염은 크게 신경쓰지 않아도되고 시간을 다투는 일도 아닙니다.
장간 췌장 쓸개 이런 곳을 볼 수 있습니다.
빨리 회복하세요.",https://www.hidoc.co.kr/healthqna/part/view/C0000488834
기침하다 등이결렸는데 너무아파요,2019.12.24,"기침을하다가 등이 결렸는데 그뒤로 너무아프네요
엑스레이상은 이상없다는데 사진상으로는 약간휜거같기도하고 휜부분이 근육이 뭉쳤을거 같다고하네요
어떻게 치료해야하나요",강기원 [한의사],"안녕하세요. 하이닥 한방과 상담의 강기원입니다.

기침하다 근육이 긴장되어 통증이 발생한 것 같습니다.
다행히 뼈엔 문제가 없는 듯 하니 너무 걱정 마시고
한의원에서 침, 추나 등 치료를 받으시길 권해드립니다.",https://www.hidoc.co.kr/healthqna/part/view/C0000488863
코피 시술인가? 소작법인가? 비출혈? 그거 부작용 있나요? 그것에 대한 정보좀 알려주세요?,2019.12.24,코피 시술인가? 소작법인가? 비출혈? 그거 부작용 있나요? 그것에 대한 정보좀 알려주세요?,홍인표 [전문의],"안녕하세요. 하이닥 가정의학과 상담의 홍인표입니다.
약물이나 레이저로 혈관부위를 피가 안나도록 지지는 것인데 약간의 통증이 있을 수 있어요.
그 외에는 별다른 게 없어요.",https://www.hidoc.co.kr/healthqna/part/view/C0000488864
흉부 복부CT,2019.12.24,"안녕하세요 저번에 글 올렸는데 기침계속 나오고 흉통이 있어서 규모가 좀 큰 종합병원에 내원하여서 저선량 흉부CT를 찍고 싶다고 했더니 그러지 말고 너무 걱정하시는거 같은데 조영제응 넣고 씨티를 찍어보고 이왕에 주시맞고 찍는거 복부CT도 찍어서 복부도 봅시다 하셔서 그럽시다 하고 검사 예약하고 나왔는데 흉부 하고 복부를 씨티촬영할경우 자세하게 어느장기를 볼수 있는건가요? 그리고 작은 염증까지 정확하게 나오나요?

그리고 그 전 건강검진에서 흉부 액스레이 결과 기관지염의증이라고 진단되어있는데 이거 빨리 치료받아야 되나요?",홍인표 [전문의],"안녕하세요. 하이닥 가정의학과 상담의 홍인표입니다.

기관지염은 크게 신경쓰지 않아도되고 시간을 다투는 일도 아닙니다.
장간 췌장 쓸개 이런 곳을 볼 수 있습니다.
빨리 회복하세요.",https://www.hidoc.co.kr/healthqna/part/view/C0000488834
NSE 수치관련 문의,2019.12.24,"안녕하세요
52세 남성입니다

얼마전 회사 건강검진에서 NSE 수치가 17.7으로 나왔습니다(정상범위가 ~16.4 인것 같은데요) 폐암관련 종양표지자 검사라고 하는데요 폐 X-RAY는 정상이라고 합니다 궁금한 사항은

1) 추가검사가 필요할 정도로 수치가 많이 높은 건가요?
2) 민감도가 높은 검사라 위양성이 많다고 하던데 맞나요?
3) 만약 폐에 이상이 있다면 이정도 수치로 치명적일 수도 있나요?
4) 인후두 위산 역류질환이 있어 약을 복용한지 2개월 넘었고, 고지혈증 약도 9개월 복용중인데 이러한 약의 영향으로 높을수도 있나요?

답변 부탁드립니다",류재열 [전문의],"안녕하세요. 하이닥 가정의학과 상담의 류재열입니다.

NSE수치만으로 암을 진단하지 않으며 많이 증가했을 경우 폐CT를 통해서 확인합니다.
폐암 외에도 다른 신경모세포암 및 개인 컨디션이나 염증 상태에 따라서도 증가할 수 있으며
지금 수치 정도면 별다른 이상이 없을 가능성이 높지만 확인 차원에서 추후 재검해보시거나
확실히 확인하길 원하시면 폐CT 찍어보시는 것을 권합니다.
감사합니다.",https://www.hidoc.co.kr/healthqna/part/view/C0000488819
복약상담.술약속.,2019.12.23,"12/22 (일) 저녁부터 목이 조금
12/23 (월) 이비인후과 가서 진료받고 이 그림과 같은 약을 처방받았습니다. 약 먹으니 괜찮아 졌습니다.

그런데
12/24 (화) 저녁, 와인을 마셔야하는 약속이 있는데
가능한 약을 먹는중이라면 저도 음주를 하지않지만 피할수 없는 자리라 그러는데 이럴때에는 복약을 어떻게 해야할지 궁금해서 문의글올립니다. 상담 부탁드립니다.",이문우 [약사],"안녕하세요. 하이닥 상담약사 이문우입니다.

네, 걱정되시겠네요. 가급적 금주가 좋은데요.
진통제 성분중에 아세트아미노펜제제가 간독성을 유발합니다.
또한 다른 약물들이 알콜과 상호작용이 있어서 졸릴 수도 있어요.
원래는 혈중 약물 농도가 중요하나 음주 전후에는 복용을 피하시고요.
다음날 부터 복용하세요.
감사합니다~~^^",https://www.hidoc.co.kr/healthqna/part/view/C0000488742
왼쪽가슴 통증 문의,2019.12.23,"안녕하세요

평소 뷔페를 좋아하고 고기를 좋아하는 편이거든요

3개월전쯤 그날도 과식하고 잠자기 위해 누웠는데 왼쪽 가슴 젖꼭지 겨드랑이쪽이랑
통증이 있었습니다 쿡쿡찌르고 아픈느낌 이였는데요
병원 방문은 안하고 괜찮겠지 하고 소화불량인가하고 일주일 내내 소화제 소화잘되는 약위주로 먹었는데
일주일 정도 지났는데 통증은 없졌습니다

그러다가 2달전쯤 과식하고 잠들기 위해 누웠는데
같은증상 왼쪽가슴 통증 이 발생되었습니다
2달전인데 현재까지 통증은 있고요

증상으로서는왼쪽 가슴 통증 그때보다는 통증이 덜하지만 여전합니다
잠들면 새벽에 깹니다 땀을 엄청 많이 흐르면서요 그리고 거침호흡으로 깹니다
무호흡증 같은데 숨을 안쉬다가 갑자기 내쉬는 일주일 2~3번은 경험 합니다
왼쪽가슴이 아플때 근처만져보면 핏줄인가 그게 딱딱하고 누르면 아프고요

건강 검진때
위내시경 에서는 염증 정도만 발견되었고요
심장 초음파를 했는데 10분동안 심장수가 100이상 이랍니다
그당시 혈압도 155정도 되었고요
전날 회식으로 술만 먹으면 빨게지는데 술지장이 있었던거 같고요

현재는 평상시엔 괜찮은거 같고 혈압도 136정도 135 유지합니다


낮에는 괜찮습니다
잠잘때만 그런 현상들이 발생되거든요
그래서 잠자기가 겁날정도록 그러합니다",황규엽 [전문의],"안녕하세요. 하이닥 내과 상담의 황규엽입니다.

1. 위산역류에 의한 식도염
2. 협심증
3. 근육통

통상 이런 질환을 의심해 볼수있습니다.
하지만 하나만의 질환을 진단할수 있을정도의 전형적인 증상이 아니므로
병원을 방문하여 검사를 통해 진단을 받아 보시는 것이 좋습니다.",https://www.hidoc.co.kr/healthqna/part/view/C0000488656
복약상담. 술약속.,2019.12.23,"12/22 (일) 저녁부터 목이 조금
12/23 (월) 이비인후과 가서 진료받고 이 그림과 같은 약을 처방받았습니다. 약 먹으니 괜찮아 졌습니다.

그런데
12/24 (화) 저녁, 와인을 마셔야하는 약속이 있는데
가능한 약을 먹는중이라면 저도 음주를 하지않지만 피할수 없는 자리라 그러는데 이럴때에는 복약을 어떻게 해야할지 궁금해서 문의글올립니다. 상담 부탁드립니다.",손경호 [약사],"안녕하세요. 하이닥 상담약사 손경호입니다.

와인과 상호작용을 하여 중대한 부작용을 일으키는 성분은 없습니다.
다만 알코올류 섭취에 따른 약물 농도의 증가(슈*펜정)로 졸음이 유발될 수 있고, 간기능에 무리를 줄 수 있는 성분(세*펜이알정=타*레놀)이 있어서 과도한 음주는 건강에 좋지 않습니다. 또한 알코올류는 염증의 회복을 늦추기 때문에 전반적인 치료/회복에 방해가 됩니다.

피할 수 없는 자리라면 와인은 1잔이하로만 권합니다. 약과 최소 2시간 이상 간격을 두시는게 좋습니다.
통증이 없으시면 세*펜이알서방정은 술 약속 저녁약, 다음날 아침약까지는 빼고 드시는것을 추천드립니다.
감사합니다.",https://www.hidoc.co.kr/healthqna/part/view/C0000488754
고기구울때 연기,2019.12.23,가평 펜션에서 고기구울때 숯인가 뭔가 있고 야외에서 그릴위에 고기를 구웠습니다. 이 연기 마시면 안좋나요? 고기를 많이 구워서 좀 그렇네요,홍인표 [전문의],"안녕하세요. 하이닥 가정의학과 상담의 홍인표입니다.

고기 구울 때 나는 연기에는 여러가지 화학물질이 들어있어서 냄새를 많이 맡거나 하시는 일은 절대로 피하셔야 합니다. 장기간 오래 노출되면 더 안좋아요.",https://www.hidoc.co.kr/healthqna/part/view/C0000488739
휴지 태우면 연기,2019.12.23,밖에서 휴지 태웠는데 집안까지들어오더라구요 냄새도 맡아지고 이 냄새 맡으면 안좋나요?,홍인표 [전문의],"안녕하세요. 하이닥 가정의학과 상담의 홍인표입니다.

불완전 연소된 연기에는 여러가지 안좋은 화학 물질이 포함되어 있을 가능성이 높으니 연기를 직접 마시는 것은 안좋습니다.",https://www.hidoc.co.kr/healthqna/part/view/C0000488753
방금 계단 올라가는데 핑돌고 죽을것 같고 숨엄청 차서,2019.12.22,핑돌고 죽을것 같고 숨엄청 차서 숨안셔지고 명치 아프고 명치 꽉찬 느낌나면서 심박수 180까지 찍고 이것도 공황장애 증상인가요? 명치 진짜 꽉찬 느낌나고 호흡곤란도 왔어요,김윤석 [전문의],"안녕하세요. 하이닥 정신건강의학과 상담의 김윤석입니다.

공황장애로 발생할 수 있는 증상들은 다음과 같습니다. 호흡곤란, 심장박동의 증가 및 두근거림, 질식감, 마비감, 저린감, 전율 및 떨린 느낌, 구역질 혹은 복통, 가슴통증 및 불편감, 열감 혹은 냉감, 식은땀, 비현실감, 어지러움, 죽음에 대한 공포, 통제력 상실 및 정신 이상에 대한 두려움.
공황 발작(panic attack)증상은 정상인들도 1년에 30%는 겪을 수 있기 때문에 한 차례 그러한 증상이 나타났다고 해서 모두 다 공황 장애라고 진단내리지는 않습니다. 질문자님께서 말씀하신 부분이 반복되면서 또 그러한 증상이 나타나면 어떡하나 하는 예기불안(anticipatory anxiety) 증상이 있다면 정신건강의학과에 방문하셔서 상담을 해보시기 바랍니다.
감사합니다.",https://www.hidoc.co.kr/healthqna/part/view/C0000488590
평상시에는 정상 기침,2019.12.23,평상시에는 정상 기침 소리인데 누워있을때 기침하면 가끔 컹컹 기침소리가 나는데 후두염 증상인가요??,박종원 [전문의],"안녕하세요. 하이닥 신경과 상담의 박종원입니다.
네, 교과서 적으로는 정확한 내용입니다.
barking cough라고 하는데 실제로는 다양할 수 있습니다.
기침소리만 가지고 후두염이라고 말할 수는 없습니다.
치료는 후두염의 경우 조금 더 적극적으로 항생제 등을 복용시킵니다.",https://www.hidoc.co.kr/healthqna/part/view/C0000488620
기침 소리,2019.12.23,기침 소리에서 컹컹 소리가 나는 이유가 뭘까요?,홍인표 [전문의],"안녕하세요. 하이닥 가정의학과 상담의 홍인표입니다.

그런 기침소리가 나는 경우는 후두 부위에 염증이 생겼을 때 기침을 하면 쉰목소리가 감기들었을 때 나는 것처럼
기침소리가 보통과 좀 다르게 나는 것으로 생각합니다",https://www.hidoc.co.kr/healthqna/part/view/C0000488617
기침 자주 안합니다,2019.12.23,누워있을때 기침 마려우면 기침하면 컹컹소리가 나서 물어보는겁니다 가끔 합니다!,홍인표 [전문의],"안녕하세요. 하이닥 가정의학과 상담의 홍인표입니다.
 
가끔 하는 것은 정확하게 이유를 밝히기는 어려울것 같아요.
일단은 경과 관찰하시면서 지켜보는수 밖에는 없네요.",https://www.hidoc.co.kr/healthqna/part/view/C0000488610
