title,date,question,doctor,answer,url
편도주위농양,2018.06.23,"5월 2일에 편도염이 심해져서 병원을 갔더니 편도주변농양 진단을 받고 배농 수술을 받고 입원했습니다.
퇴원 후 한두차례 편도염이 재발해서 외래진료를 받았습니다.
시험기간이라 일주일정도 매일 밤을 새다가 6월 20일즈음부터 목이 조금 거슬리더니 편도염이 재발하여 다시 병원 진료를 받고 항생제를 처방 받았습니다.

문제는 오늘부터인데 붓기가 심해지다가 결국 예전 배농 수술 받은 부위, 그니까 절개했던 부위에서 피고름이 나옵니다. 병원비가 너무 많이 나와서 다음 주에 병원 가기로 했는데 이거 심각한건가요? 지난번 재발했을때도 자고 일어나서 담배 피다가 정신 차려보니 이렇게 피가 나왔어서 이번에도 그런거겠지 하고는 있는데 조금 불안합니다. 고름이 어느 정도 나오고 난 후 부터는 말하기가 조금 쉬워졌어요. 입을 벌릴때 아프긴 하지만 크게 벌릴 때만 아픕니다.",엄문용 [전문의],"안녕하세요, 하이닥 내과 상담의 엄문용 입니다.
배농부위의 농양이 완벽하게 제거가 되었어도 제거후에 일시적인 염증반응으로 피고름같은 양상으로 분비물이 나오는 것이 정상입니다.
항생제는 복용하고 계실 것으로 생각되며 약물복용하시면 시간이 지나면서 점차 호전될 것으로 보입니다.
단, 앞으로도 재발이 잘 될 수 있는데 금연하시고 생활습관을 개선해보시기 바랍니다.",https://www.hidoc.co.kr/healthqna/part/view/C0000405429
어깨 및 옆구리 통증 그리고 소량의 객혈,2018.06.23,"안녕하세요 키 171cm 몸무게 100kg 가량의 비만입니다.
흡연자이며 하루 반갑~한갑 정도 흡연중이고
음주는 전혀 하지 않습니다.
최근 족저근막염과 종아리 근육 떨림 증세로
소염진통제와 마그네슘제를 처방받아 복용하고 있습니다.
어젯 밤 자기 전에 갑자기 뭉친 것 처럼 오른쪽 쇄골부터 목 그리고 날개뼈를 잇는 부분에 콕콕 찌르는 듯한 통증이 발생했고, 동시에 오른쪽 옆구리 갈비뼈 중간부분 쯤에도 역시 같은 통증이 발생하고 있습니다. 평소 숨에 비해 반만 들이마셔도 통증이 일어나서 호흡이 불안정한 상태이고, 3-5회 정도 가래에서 아주 약간의 피가 섞여 나왔습니다.
현명한 답변 부탁드리겠습니다.. 운동부족인지 병적 증상인지 단순한 근육통인지 대략적인 파악만 가능하다면 좋겠습니다. 항상 힘써 주셔서 감사합니다",엄문용 [전문의],"안녕하세요, 하이닥 내과 상담의 엄문용 입니다.
흡연하는 젊은 남성에서의 객혈은 무시하고 넘어갈 수 없는 증상입니다.
가래를 뱉으면서 나왔다는 말은 토혈은 거의 가능성이 없고 말그대로 객혈의 가능성이 높은데 단순 후두염증에 의한 객혈일 수도 있으나 폐암이나 기타 호흡기질환을 감별해보셔야 합니다.
가까운 종합병원이상의 이비인후과에 내원하셔서 목, 폐CT를 시행해보시는 것이 좋겠습니다.",https://www.hidoc.co.kr/healthqna/part/view/C0000405433
숨을쉴때 크게 들이마셔야 숨쉬는거 같은 느낌이 듭니다.,2018.06.20,"숨을쉴때 크게 들이마셔야 숨쉬는거 같은 느낌이 듭니다.
몇일전 과호흡으로 응급실 다녀온후 부터
숨쉬는거가 불편한데 무엇이 문제일까요",이방훈 [전문의],"안녕하세요, 하이닥 내과 상담의 이방훈 입니다.

과호흡과 연관된 증상으로 생각됩니다.
응급실에서 엑스레이랑 기본적인 검사를 했을 것이고
검사상에서는 별다른 이상이 없었을 것으로 추정됩니다.
즉, 기질적인 요인이 없는 심리적인 문제라는 것입니다.
지속된다면 가까운 병의원을 방문해서 폐기능검사를 받아보는 것도 도움이 될 것 같습니다.",https://www.hidoc.co.kr/healthqna/part/view/C0000403868
가만히 앉아 있는데 갑자기 등전체가 쪼여오며 담이 걸린듯 아파 숨쉬기가 힘들었어요,2018.06.17,가만히 앉아 있는데 갑자기 등전체가 쪼여오며 담이 걸린듯 아파 숨쉬기가 힘들었어요. 조금씩 큰 숨을 쉬며 움직여 봤고 10분쯤뒤 조금 괜찮은 듯 한데 여전히 날개죽지밑 중앙으로 뻐근합니다.등을 옆으로 움직이기가 힘들고 가끔씩 날개죽지 밑으로. 가슴밑 갈비뼈 쪽으로 숨을 쉴수 없을 정도로 근육이 조여오는 통증이 생깁니다. 불편함은 길면 하루 이상 갈때도 있었고 몇시간 뒤 괜찮아 지기도 합니다. 어디가 문제 일까요,유태중 [전문의],"안녕하세요, 하이닥 마취통증의학과 상담의 유태중 입니다.
가까운 통증의학과를 방문하시어 전문의에 진료를 받아보시기 권합니다.
불편한 부위의 근육의 긴장이 증상 만들기도 하나 경추가 원인이 되어 증상이 나타나기도 합니다.
평소 생활습관이나 자세가 괜찮은지 다시한번 돌아보시기 바랍니다.
아울러 온찜질 이나 진통소염제 복용도 도움이 될 수 있습니다.",https://www.hidoc.co.kr/healthqna/part/view/C0000402388
만성폐쇄성폐질환판정을받은 60세입니다,2018.06.21,만성폐쇄성폐질환판정을받은 60세입니다 폐활량검사를해보니 정상적인폐가 39%정도라는데 담배끊고 흡입약꾸준히한다면 언제까지 생명을유지할수있을까요 약흡입후지금은 큰불불편함은없읍니다,한재병 [전문의],"안녕하세요, 하이닥 응급의학과 상담의 한재병 입니다.

언제까지 생명을 유지할 수 있을 지 말씀드릴 수 있는 분은 아무도 없습니다.
빠른 시일내 담배 끊으시구요.
처방 받은 약 꾸준히 잘 챙기시며, 과격한 움직임은 피하시되, 꾸준한 운동을 하시기를 추천합니다.
감기, 페렴 등을 조심하시구요.",https://www.hidoc.co.kr/healthqna/part/view/C0000404660
제가 요즘 코피가 자주나는데 왜이럴까요?,2018.06.22,제가 요즘 코피가 자주나는데 왜이럴까요?ㅜ 요즘 새벽1시~2시에 자는데 잠때문일까요?아니면 왜이럴까요 ㅜ,최승영 [한의사],"안녕하세요, 하이닥 한방과 상담의 최승영 입니다.

코피의 가장 흔한 원인은 피로, 원기저하입니다.
수면부족이 직접적인 원인이 될 수 있습니다.",https://www.hidoc.co.kr/healthqna/part/view/C0000404720
"산소포화도가 평상시에 92-94라서, 정상보다 낮은가해서. 걱정입니다",2018.06.22,"산소포화도가 평상시에 92-94라서, 정상보다 낮은가해서. 걱정입니다. 외국 나가서 3000미터만 넘으면 숨쉬기도 어렵구요. 이게 병인가요? 산소포화도를 높일수 있는 방법은 무엇인가요?",한재병 [전문의],"안녕하세요, 하이닥 응급의학과 상담의 한재병 입니다.

산소포화도를 어떤 방식으로 측정하셨는지에 대해서부터 정확히 하셔야할것 같습니다.
특별한 문제 없는 분이 일반적인 상황에서 산소포화도가 92~94 수준이라면 문제가 있습니다.
병원에서 정확한 진료가 필요한 상황이십니다.",https://www.hidoc.co.kr/healthqna/part/view/C0000404735
몇일전 호픕곤란이 심해져서 병원을찿아 폐기능검사등을했는데 만성폐쇄성 폐질환이라는 판정을받았읍니다,2018.06.21,안녕하세요 나이는 59세이구요 몇일전 호픕곤란이 심해져서 병원을찿아 폐기능검사등을했는데 만성폐쇄성 폐질환이라는 판정을받았읍니다 현제 정상적인폐는 39%랍니다 아직담배를끊지못해 조금씩줄여가고있습니다.조제해준 흡입약계속복용하면 언제까지 생명을 연장할수있는지요,한재병 [전문의],"안녕하세요, 하이닥 응급의학과 상담의 한재병 입니다.

정해진건 없습니다.
단.. 현재부터라도 담배 끊으시구요.
숨이 차는 급격한 활동은 줄이시며, 조금씩이라도 천천히 많이 움직이시기를 권유합니다.
일상적인 삶에서는 생각보다 꽤 오래 사실 수 있으니 너무 걱정 마시구요.
단 환절기 등에 감기나 폐렴 등은 꼭 조심하세요.",https://www.hidoc.co.kr/healthqna/part/view/C0000404667
평소 심한운동도 하지않는데 아침출근길 평소걸음으로 걸어도 가슴에 통증이 있습니다,2018.06.22,"평소 심한운동도 하지않는데 아침출근길 평소걸음으로
걸어도 가슴에 통증이 있는데 심한정도는아닌데
그리고 눈주위 에 피멍이 자주생기는데 왜그런가요
1965년생ㅋ155. 몸무게 51정도입니다",김소연 [전문의],"안녕하세요, 하이닥 내과 상담의 김소연 입니다.

혹시 뛰거나 할때도 증상이 유발되시나요?
걸을때마다 통증이 약간 있다가 쉬면 사라진다면 협심증을 의심할수 있는 초기증상일수도 있습니다.
가까운 순환기내과를 방문해보세요.
눈주위는 혈관자체가 약한 부위로 적은 자극에서도 쉽게 멍이 들거나 상처가 생기실수도 있는데 저절로 멍이 들고 한다면
혈소판이나 혈액응고 기능에 문제가 생겼을수도 있으니 피검사를 해보시는게 좋겠습니다.",https://www.hidoc.co.kr/healthqna/part/view/C0000404750
얼마전부터 담배를 배워 하루 반갑정도 피는데 이유가 그것때문인지 가슴에 불편함이 있습니다.,2018.06.19,"얼마전부터 담배를 배워 하루 반갑정도 피는데 이유가 그것때문인지 가슴에 불편함이 있습니다.
꾸준히 아프거나 그런것은 아닌데 가끔 살짝 살짝 느낌이 온다고할까요? 폐암 이런건 아니겠죠?",박상기 [전문의],"안녕하세요, 하이닥 내과 상담의 박상기 입니다.

글쎄요!

이러한 정황만으로 폐암 이야기를 하는것은 무리가 있습니다. 나이도 필요하고요.

폐암은 꼭 담배를 피워야 생기는것은 아니고 담배를 피우면 좀 더 발생률이 올라가는것입니다.

항상 담배를 피울 때만 말씀하신 증상이 생기고 안 필때는 생기지 않는다면 담배와 연관이 있다고 할 수 있지만 꼭 그런것이 아니라면 먼저 담배와 연관을 짓기 보다는 증상을 따로 보고 진료를 받아 보시는것이 좋습니다.

감사합니다.",https://www.hidoc.co.kr/healthqna/part/view/C0000403144
혹시 이러한 상황에서 성관계가 심장에 무리를 줄수있나요?,2018.06.12,"28살 금연 5일차인 남성입니다.

왼쪽 가슴. 어깨 등 옆구리쪽의 통증이 지속되며
왼쪽 가슴에 찌르는 통증이 지속되는 상황인데

혹시 이러한 상황에서 성관계가 심장에 무리를 줄수있나요?
하루에 3번 정도 숨이 많이 차는 현상을 경험 하고 있습니다.
(숨막혀 죽겠다 수준은 아님. 숨쉬기가 힘든..)

운동은 거의 안해서 요즘 심장이 어느수준까지 버텨줄지 모르겠네요.",김소연 [전문의],"안녕하세요, 하이닥 내과 상담의 김소연 입니다.

가급적이면 숨이차는상황에서는 하지 않는게 좋지 않을까요?
금연 하면서 여러가지 금단증상을 경험하실수 있는데 많이 힘들면 금연 보조제 도움을 받을수 있겠습니다.",https://www.hidoc.co.kr/healthqna/part/view/C0000400863
금연을 위해 경구용치료제 챔*스를 복용하고 있습니다,2018.06.21,"항암치료중인 58세 남자입니다..
금연을 위해 경구용치료제 챔*스를 복용하고 있습니다.. 괜찮은지 궁금합니다..감사합니다.",김소연 [전문의],"안녕하세요, 하이닥 내과 상담의 김소연 입니다.

고생이 많겠습니다.

항암치료중이라하시면 꼭 금연을 하시는게 좋겠습니다.
본인의 의지만으로는 어려운 부분이 많을테니 챔\*스를 복용하면서 금연을 시도하는 방법도 괜찮겠습니다.
항암중인경우 항암 부작용으로 오심 구토가 있을수 있을텐데 그런 기간이 좀 지났을 때 약을 먹는게 좋겠습니다.
담당의사분과 상의해보시기 바랍니다.",https://www.hidoc.co.kr/healthqna/part/view/C0000404289
건강검진에서 우하엽폐부피감소의증 이라는 진단을 2년 연속 받았어요,2018.06.21,"건강검진에서 우하엽폐부피감소의증 이라는 진단을 2년 연속 받았어요
따로 병원가서 검사 받아보라 그래서 갔었는데, 유치원정도때 폐렴을 3개월 오래 앓은 적이 있어서 병원에서는 엑스레이만 보면 폐에 상처가 좀 있는 것 같고 숨쉴때 쇳소리가 좀 난다고는 했는데, 정확 왜 폐가 감소하는지는 따로 정밀검사를 해봐야한다고 하더라구요. 일상생활엔 지장이 없고 뭐가 크게 와닿지 않고, 입원하고 MRI찍고 할 여유가 안돼서 그냥 나왔는데, 폐부피가 감소하는 이유가 뭘까요..?? 미세먼지때문일까요@? 엑스레이 찍을때 숨을 작년보다 작게 쉬면 부피가 감소한거처럼 나오는거 아닌가요..? 2년 연속 검사소견으로 나올 정도면 유의미한 증감이라고 볼 수 있을까요? 증상에 대한 가능한 원인과 추가적인 의사선생님의 소견이 궁금합니다.",김소연 [전문의],"안녕하세요, 하이닥 내과 상담의 김소연 입니다.

우하엽 폐부피 감소의증??... 아마 무기폐 를 말하는것 아닐지 생각됩니다.
대부분 여자분들에서 숨을 크게 잘안쉬고 얕게 쉬거나 감기를 앓고 가래가 있어 기관지가 막히는 경우 일부 폐포가 닫혀서 공기가 통하지 않는 짜부라든 폐포가 될수도 있어요
실제로 약간의 무기폐는 거의증상이 없기때문에 치료가 필요하지 않습니다.
또한 저절로 잘 좋아지지 않구요.
폐활량을 증가시킬수 있는 유산소 운동을 꾸준히 하시는게 좋겠습니다.",https://www.hidoc.co.kr/healthqna/part/view/C0000404195
기침을 심하게 자주해 왼쪽가슴 위쪽에 담이 온것 같이 땡기네요.,2018.06.21,"기침을 심하게 자주해 왼쪽가슴 위쪽에 담이 온것 같이 땡기네요. 가능한 일인가요?

어떻게 하면 통증이 완화될까요?",김소연 [전문의],"안녕하세요, 하이닥 내과 상담의 김소연 입니다.

네 기침 심하게 하면 갈비뼈에도 금이 갈수도 있고 담이 올수도 있고 땡겨요..
심하면 진통제 와 근육 이완제를 복용할수도 있구요. 물리치료를 받을수도 있어요
하지만 기침을 일단 멈추는게 중요하겠지요
기침이 지속된다면 기침이 오래되는 원인이 여러가지 있으니 가까운 병원에 가셔서 상담 받아보세요",https://www.hidoc.co.kr/healthqna/part/view/C0000404161
물마시다가 사래걸려서요,2018.06.21,"물마시다가 사래걸렸는데 괜찮을줄알고 물을 다 삼켰습니다. 그런데 그다음에 심하게 기침하다가 10초정도 숨이 안쉬어져서 무서웠습니다. 그 뒤로는 숨은 잘 쉬어지고 기침도 멈췄지만 인터넷에 보니까 폐로 물이 넘어가서 병에 걸릴수있다고해서요. 20대고 다른병은 없습니다. 현재는 심리적으로 그런건지 숨쉴때 불편한것같기도 하고,..겁이 나서 질문올립니다.",서종필 [전문의],"안녕하세요, 하이닥 내과 상담의 서종필 입니다.
기도로 물이 넘어가더라도 기침과 섬모 작용을 통해 다시 밖으로 배출되게 됩니다. 즉 사래가 걸리면 아주 격렬한 기침반응에 의해 다시 외부로 이물질이 배출되게 되어 있습니다. 단순히 물이었다면 대부분 큰 문제 없이 회복됩니다. 단 간혹 노약자 혹은 어린이들은 물 이외에 다른 이물질이 기도로 삽입되어 이물질 제거 수술 기관지 내시경 을 통한 제거술 시행 혹은 흡인성 폐렴 등이 발생하기도 합니다. 증상이 지속되고 불안하시면 가까운 내과에서 흉부엑스레이를 통해 확인하시면 폐렴여부는 바로 아실수 있습니다.",https://www.hidoc.co.kr/healthqna/part/view/C0000404155
물마시다가 사래걸려서요,2018.06.21,"물마시다가 사래걸렸는데 괜찮을줄알고 물을 다 삼켰습니다. 그런데 그다음에 심하게 기침하다가 10초정도 숨이 안쉬어져서 무서웠습니다. 그 뒤로는 숨은 잘 쉬어지고 기침도 멈췄지만 인터넷에 보니까 폐로 물이 넘어가서 병에 걸릴수있다고해서요. 20대고 다른병은 없습니다. 현재는 심리적으로 그런건지 숨쉴때 불편한것같기도 하고,..겁이 나서 질문올립니다.",서종필 [전문의],"안녕하세요, 하이닥 내과 상담의 서종필 입니다.
기도로 물이 넘어가더라도 기침과 섬모 작용을 통해 다시 밖으로 배출되게 됩니다. 즉 사래가 걸리면 아주 격렬한 기침반응에 의해 다시 외부로 이물질이 배출되게 되어 있습니다. 단순히 물이었다면 대부분 큰 문제 없이 회복됩니다. 단 간혹 노약자 혹은 어린이들은 물 이외에 다른 이물질이 기도로 삽입되어 이물질 제거 수술 기관지 내시경 을 통한 제거술 시행 혹은 흡인성 폐렴 등이 발생하기도 합니다. 증상이 지속되고 불안하시면 가까운 내과에서 흉부엑스레이를 통해 확인하시면 폐렴여부는 바로 아실수 있습니다.",https://www.hidoc.co.kr/healthqna/part/view/C0000404155
체온이 떨어지고 면역력이 낮아져 비염이 온게 아닌가싶네요.연관이 있겠죠?,2018.06.20,"비위(脾胃) 기능이 떨어져 장의 흐름이 좋지 못하고 찬 경우에도 몸의 대사작용이 떨어지고 체온과 면역력이 떨어지기 때문에 비염이 발생하기도 합니다. 한방에서는 비염은 면역체계의 불균형을 원인으로 봅니다.

안녕하세요,선생님.
인터넷으로 정보를 찾다가 선생님글을 읽었고 궁금한게 있어 여쭙니다.
제아들 네살인데요. 알레르기비염이라고 진단
받았어요. 윗글을보면 장이 따뜻해야 한다고 하셨는데 제아들이 평소 잘때 이불을 전혀 안덥고 자고요. 찬음식도 좋아하는데요. 그래서 체온이 떨어지고 면역력이 낮아져 비염이 온게 아닌가싶네요.연관이 있겠죠?",윤재석 [한의사],"안녕하세요, 하이닥 한방과 상담의 윤재석 입니다.
알레르기비염의 경우 여러 원인이 발단이 될수있습니다
물론 지금 말씀하신대로 배를 따뜻하게 덥지않고 잘경우 페-대장의 상호작용으로 인해 자극이
될 수 있습니다 가까운 한의원에 내원하셔서 정확한 진단후 치료하시길 바랍니다 감사합니다^^",https://www.hidoc.co.kr/healthqna/part/view/C0000403959
가끔씩 가슴통증을 느끼는데 뭐가 원인인지 모르겠네요,2018.06.17,"21살 남자입니다
가끔씩 가슴통증을 느끼는데 뭐가 원인인지 모르겠네요
심박수는 가만히있을때 70에서 90사이 나오네요",김소연 [전문의],"안녕하세요, 하이닥 내과 상담의 김소연 입니다.

가슴중간이 아프신가요? 아니면 폐쪽 오른쪽 이나 왼쪽이나 한군데가 아프신가요?
연령대를 고려하면 혈관문제 가능성은 떨어져보이고
대부분 폐에 급성으로 약간의 염증소견이 생긴게 흔히 있을수 있습니다. 아니면 숨쉴때마다 아프고 옆구리쪽이라하면 갈비뼈에 금이 갔거나 갈비뼈 밑을 지나가는 신경의 염증일수 있구요
최근 흡연을 시작하였거나 공기가 안좋은 공간에서 야외 일을하거나 하진 않았는지요?
아니면 운동을 해서 근육통일수도 있습니다.
여러가지 원인이 있을수 있으니 가까운 병원에가셔서 가슴 엑스레이 검사를 해보세요",https://www.hidoc.co.kr/healthqna/part/view/C0000402449
가끔 심장이 너무 빨리 뛰어서 호흡도 가쁘고 가슴에 통증?? 비슷하게 오는데 왜 그런걸까요,2018.06.16,"나이 만 22 키 167 몸무게 59
가끔 심장이 너무 빨리 뛰어서 호흡도 가쁘고 가슴에 통증?? 비슷하게 오는데 왜 그런걸까요...
방금 심박수 확인 했더니 99정도 나왔습니다.",이방훈 [전문의],"안녕하세요, 하이닥 내과 상담의 이방훈 입니다.
부정맥의 가능성을 생각해봐야 합니다.
심장이 빨리 뛰는 느낌이 들 때 가장 가까운 병의원을 방문해서 심전도 검사를 해보면 도움이 될 것 같습니다.
부정맥이라는 것이 확인 되면 그 다음 과정으로 관련된 검사를 진행하면 될 것 같습니다.",https://www.hidoc.co.kr/healthqna/part/view/C0000402329
잠을잘때랑 일상생활할때도 코피가 자주흐르내요,2018.06.19,어려슬때부터 지금까지 잠을잘때랑 일상생활할때도 코피가 자주흐르내요 괸찬은건지궁금하내요,양태규 [한의사],"안녕하세요, 하이닥 한방과 상담의 양태규 입니다.

코피가 잘 나는데 검사상 혈액응고 기전에 문제가 없다면 몇가지 문제가 되는 것 중에서 비염과 관련되서 생기는 코피일 가능성이 많아 보입니다. 이런 경우 한약을 복용해서 비강 점막을 튼튼하게 하고 비염을 잘 조절해 주면 코피가 잘 나지 않게 되는 경우가 많지요. 잦은 코피가 걱정이 되시면 가까운 한의원에 내원해서 상담을 받아보시기 바랍니다. 감사합니다.",https://www.hidoc.co.kr/healthqna/part/view/C0000403651
"운동을 하면 가슴정중앙, 명치 안부분이 조이는듯한 느낌이 드는데 이것도 식도염 증상인가요...?",2018.06.20,"운동을 하면 가슴정중앙, 명치 안부분이 조이는듯한 느낌이 드는데 이것도 식도염 증상인가요...?

식도염이 자주 있어서 가슴통증이나 답답함이 자주있어서 요즘 계단오르는 운동을 하는데요.

보통 1층에서 14층까지 올라가는데 숨은 약간 차고 그렇게 힘들진 않은데 가슴속 명치?가슴정중앙? 속이 조이는듯한 느낌이있습니다. 가끔 목안도 부어올라 조이구요.

식도염도 이런증상이 있나 궁금해서 찾아보니
협심증일 수 도 있다고 해서요..

아니면 보통 14층까지 올라가면 가슴에 통증이오는게 정상인가요??

식도염때문에 가슴통증에 예민해진건지 잘모르겠습니다ㅠ

식도염증상이 맞나요..? 아니면 협심증검사를 해봐야할까요?
그것도 아니면 원래 통증이오는게 정상인가요..?ㅠ

감사합니다.",엄문용 [전문의],"안녕하세요, 하이닥 내과 상담의 엄문용 입니다.
가슴통증은 의사들이 진단하기 어려운 증상중에 하나입니다.
안정시에 통증이 유발되는지, 운동으로 더 악화되는 통증인지, 식사와 관련이 있는지. 빈속에 더 심한지 등등 기본적으로 알아야 할 정보들이 필요합니다.
현재로서는 역류성식도염과 협심증에 대한 평가가 모두 필요한 상황으로 가까운 내과에 내원하셔서 자세한 상담을 받아보시기 바랍니다.",https://www.hidoc.co.kr/healthqna/part/view/C0000403920
왼쪽 가슴 아래부근이 조여오는듯한 통증이 두시간째 계속되고 있습니다,2018.06.15,"나이 41세
남자
키182
몸무게 86

왼쪽 가슴 아래부근이 조여오는듯한 통증이 두시간째 계속되고 있습니다 바로 병원을 가야하나요",엄문용 [전문의],"안녕하세요, 하이닥 내과 상담의 엄문용 입니다.
가슴통증은 의사들이 진단하기 어려운 증상중에 하나입니다.
안정시에 통증이 유발되는지, 운동으로 더 악화되는 통증인지, 식사와 관련이 있는지. 빈속에 더 심한지 등등 기본적으로 알아야 할 정보들이 필요합니다.
현재로서는 역류성식도염과 협심증에 대한 평가가 모두 필요한 상황으로 가까운 내과에 내원하셔서 자세한 상담을 받아보시기 바랍니다.",https://www.hidoc.co.kr/healthqna/part/view/C0000402102
몇일간 두통이 있으면서 속이 쓰리고 울렁거려서 약을 어제 밤부터 먹고 있긴합니다,2018.06.15,"몇일간 두통이 있으면서 속이 쓰리고 울렁거려서 약을 어제 밤부터
먹고 있긴하는대요.
가끔 어쩌다가는 가슴 콕콕 찌르는듯이 지속되는대 이유가 뭘까요? 여성 167 몸무게 대략 65정도 한답니다",이효정 [전문의],"안녕하세요, 하이닥 내과 상담의 이효정 입니다.
흉통의 원인은 매우 다양합니다.
흉통의 양상, 지속시간, 유발인자, 완화인자, 평소 고혈압, 당뇨등의 위험인자 여부 등에 따라서 진단과정이 달라지기도 합니다.
가슴의 통증의 경우 위험한 협심증 등을 배제하는 것이 우선이기 때문에 통증이 지속이 된다면 가까운 병의원에 내원하시기 바랍니다.
속이 울렁거리고, 구토 증상이 있었다면 역류성 식도염의 경우도 흉통을 유발할 수 있습니다.

답변이 도움이 되었길 바랍니다. 감사합니다.",https://www.hidoc.co.kr/healthqna/part/view/C0000401614
